titulo,moeda,preco_promo,condition_promo,parcelado,memoria,oled,lite,joy_con,marca,console
Adaptador rj45 usb 3.0 lan nintendo switch windows,R$,116.3,no Pix ,ou 265.80 em 5x de 53.16 sem juros,-,Nao,Nao,Nao,Nintendo,Nintendo Switch
Headset Fone Microfone Gamer Camuflado Compativel Pc Ps4 Xbox Nintendo Switch Oivo,R$,123.84,no Pix ,ou 175.00 em 3x de 58.33 sem juros,-,Nao,Nao,Nao,Nintendo,Nintendo Switch
Naruto Shippuden: Ultimate Ninja Storm Trilogy Nintendo (Code In Box) - Switch,R$,239.22,no Pix ,ou 269.00 em 5x de 53.80 sem juros,-,Nao,Nao,Nao,Nintendo,Nintendo Switch
Case Capa Compatível com Nintendo Switch + Película Vidro Oled + 4 Grips Zelda + Par Silicone Joycon,R$,168.0,no Pix ,ou 517.00 em 10x de 51.70 sem juros,-,Sim,Nao,Nao,Nintendo,Nintendo Switch
Capa Compatível Nintendo Switch Pro Controle Case - Modelo 007,R$,34.99,no Pix ,ou 197.89 em 4x de 49.47 sem juros,-,Nao,Nao,Nao,Nintendo,Nintendo Switch
Capa Compatível Nintendo Switch Pro Controle Case - Final Fantasy Vii: Remake,R$,34.99,no Pix ,ou 698.99 em 5x de 139.80 sem juros,-,Nao,Nao,Nao,Nintendo,Nintendo Switch
Película De Vidro Compativel Novo Nintendo Switch Oled,R$,28.79,no Pix ,ou 308.80 em 6x de 51.47 sem juros,-,Sim,Nao,Nao,Nintendo,Nintendo Switch
Case Bolsa Estojo Compatível Nintendo Switch Alça com Ombro Transporte,R$,258.24,no Pix ,ou 339.00 em 7x de 48.43 sem juros,-,Nao,Nao,Nao,Nintendo,Nintendo Switch
Skin Compatível Nintendo Switch Adesivo - Modelo 064,R$,49.99,no Pix ,ou 399.00 em 8x de 49.88 sem juros,-,Nao,Nao,Nao,Nintendo,Nintendo Switch
Kit Capa De Silicone Tpu + Película De Vidro Nintendo Switch,R$,80.99,no Pix ,ou 799.90 em 10x de 79.99 sem juros,-,Nao,Nao,Nao,Nintendo,Nintendo Switch
Transmissor De Áudio Bluetooth Compatível Com Nintendo Switch Playstation 5 PS4 Computador Adaptador USB,R$,98.9,no Pix ,ou 109.89 em 2x de 54.95 sem juros,-,Nao,Nao,Nao,Nintendo,Nintendo Switch
Capa Case Proteção Tpu Macio Transparente Para Joycon Compativel com Nintendo Switch Padrao,R$,59.0,no Pix ,ou 215.80 em 4x de 53.95 sem juros,-,Nao,Nao,Nao,Nintendo,Nintendo Switch
Capa Anti Poeira e Skin Compatível Nintendo Switch - Nintendinho Nes,R$,79.0,no Pix ,ou 386.66 em 8x de 48.33 sem juros,-,Nao,Nao,Nao,Nintendo,Nintendo Switch
Case Compatível Nintendo Switch Lite Bolsa Estojo - Kingdom Hearts 3,R$,39.99,no Pix ,ou 99.70 em 2x de 49.85 sem juros,-,Nao,Sim,Nao,Nintendo,Nintendo Switch
Cartao de memoria micro sd 128gb sandisk nintendo switch classe 10 - sdsqxao-128gb-gnczn,R$,199.9,no Pix ,ou 349.90 em 4x de 87.48 sem juros,-,Nao,Nao,Nao,Nintendo,Nintendo Switch
Maleta Estanque Compatível com Nintendo Switch,R$,496.32,no Pix ,ou 379.80 em 6x de 63.30 sem juros,-,Nao,Nao,Nao,Nintendo,Nintendo Switch
Case Compatível Nintendo Switch Bolsa Estojo - Modelo 026,R$,39.99,no Pix ,ou 449.90 em 9x de 49.99 sem juros,-,Nao,Nao,Nao,Nintendo,Nintendo Switch
Case Compatível Nintendo Switch Bolsa Estojo - Diablo Iii,R$,39.99,no Pix ,ou 189.00 em 4x de 47.25 sem juros,-,Nao,Nao,Nao,Nintendo,Nintendo Switch
Case Compatível Com Nintendo Switch Estojo Proteção Viagem + 2 películas,R$,95.71,no Pix ,ou 99.70 em 2x de 49.85 sem juros,-,Nao,Nao,Nao,Nintendo,Nintendo Switch
Capa Anti Poeira e Skin Compatível Nintendo Switch Oled - Cuphead,R$,79.0,no Pix ,ou 119.00 em 2x de 59.50 sem juros,-,Sim,Nao,Nao,Nintendo,Nintendo Switch
Capa Case Proteção Grip Joycon Tpu Macio Compativel com Nintendo Switch Padrao,R$,119.0,no Pix ,ou 99.00 em 2x de 49.50 sem juros,-,Nao,Nao,Nao,Nintendo,Nintendo Switch
Capa Case De Proteção Resistente Para Dock Station Compativel com Nintendo Switch Padrao,R$,99.0,no Pix ,ou 349.90 em 4x de 87.48 sem juros,-,Nao,Nao,Nao,Nintendo,Nintendo Switch
Mario Party Superstars para Nintendo Switch,R$,332.41,no Pix ,ou 379.80 em 6x de 63.30 sem juros,-,Nao,Nao,Nao,Nintendo,Nintendo Switch
Animal Crossing New Horizons (I) - Switch,R$,341.82,no Pix ,ou 408.80 em 6x de 68.13 sem juros,-,Nao,Nao,Nao,Nintendo,Nintendo Switch
Grip Suporte De Controle Joy Con Nintendo Switch Vermelho,R$,39.5,no Pix ,ou 324.99 em 7x de 46.43 sem juros,-,Nao,Nao,Nao,Nintendo,Nintendo Switch
EA Sports FC 24 - Switch,R$,367.92,no Pix ,ou 349.90 em 7x de 49.99 sem juros,-,Nao,Nao,Nao,Nintendo,Nintendo Switch
Jogo Super Smash Bros Ultimate Nintendo Switch,R$,311.99,no Pix ,ou 339.99 em 7x de 48.57 sem juros,-,Nao,Nao,Nao,Nintendo,Nintendo Switch
Grip Skull &amp Co Analógico para Nintendo Switch Reparo Padrão,R$,78.12,no Pix ,ou 159.00 em 3x de 53.00 sem juros,-,Nao,Nao,Nao,Nintendo,Nintendo Switch
Mario + Rabbids Sparks of Hope - Nintendo Switch,R$,335.9,no Pix ,ou 149.00 em 3x de 49.67 sem juros,-,Nao,Nao,Nao,Nintendo,Nintendo Switch
Case Bolsa Estojo Nintendo Switch Vermelha + Película Vidro,R$,75.73,no Pix ,ou 119.00 em 2x de 59.50 sem juros,-,Nao,Nao,Nao,Nintendo,Nintendo Switch
Capa Anti Poeira Compatível Nintendo Switch - Fifa 20,R$,44.99,no Pix ,ou 149.00 em 3x de 49.67 sem juros,-,Nao,Nao,Nao,Nintendo,Nintendo Switch
Jogo Xenoblade Chronicles 3 - Nintendo Switch Nacional,R$,326.39,no Pix ,ou 416.00 em 4x de 104.00 sem juros,-,Nao,Nao,Nao,Nintendo,Nintendo Switch
Par De Grip Joycon Controller Nintendo Switch Console Game,R$,42.71,no Pix ,ou 299.90 em 6x de 49.98 sem juros,-,Nao,Nao,Nao,Nintendo,Nintendo Switch
Case Compatível Nintendo Switch Bolsa Estojo - Modelo 006,R$,39.99,no Pix ,ou 374.80 em 6x de 62.47 sem juros,-,Nao,Nao,Nao,Nintendo,Nintendo Switch
2 Pulseiras Faixa Strap Alça Perna Switch Esportes Joycon Compativel com Nintendo Switch ou Oled,R$,159.0,no Pix ,ou 189.00 em 4x de 47.25 sem juros,-,Sim,Nao,Nao,Nintendo,Nintendo Switch
Capa Case Proteção Premium Grip Ergonômico Compatível com Nintendo Switch Oled,R$,149.0,no Pix ,ou 129.90 em 2x de 64.95 sem juros,-,Sim,Nao,Nao,Nintendo,Nintendo Switch
Capa Case Proteção Grip Joycon Tpu Macio Compativel com Nintendo Switch Padrao,R$,119.0,no Pix ,ou 349.90 em 3x de 116.63 sem juros,-,Nao,Nao,Nao,Nintendo,Nintendo Switch
Capa Case Proteção Premium Grip Ergonômico Compativel com Nintendo Switch Oled,R$,149.0,no Pix ,ou 325.49 em 7x de 46.50 sem juros,-,Sim,Nao,Nao,Nintendo,Nintendo Switch
"Jogo Switch Super Mario Bros Wonder, Nintendo NINTENDO",R$,416.0,no Pix ,ou 199.00 em 4x de 49.75 sem juros,-,Nao,Nao,Nao,Nintendo,Nintendo Switch
Tactics Ogre: Reborn Nintendo Switch,R$,284.91,no Pix ,ou 374.80 em 6x de 62.47 sem juros,-,Nao,Nao,Nao,Nintendo,Nintendo Switch
Tokyo 2020 Olympic Games - The Official Video Game - Switch,R$,337.32,no Pix ,ou 449.00 em 6x de 74.83 sem juros,-,Nao,Nao,Nao,Nintendo,Nintendo Switch
Capa Case e Skin Adesivo Compatível Nintendo Switch Pro Controle - Monster Hunter Rise,R$,54.99,no Pix ,ou 209.80 em 4x de 52.45 sem juros,-,Nao,Nao,Nao,Nintendo,Nintendo Switch
Capa Anti Poeira Compatível Nintendo Switch - Modelo 016,R$,44.99,no Pix ,ou 214.80 em 4x de 53.70 sem juros,-,Nao,Nao,Nao,Nintendo,Nintendo Switch
"Pelicula 0,3mm Vidro Temperado Tela Nintendo Switch Oled",R$,27.73,no Pix ,ou 112.00 em 2x de 56.00 sem juros,-,Sim,Nao,Nao,Nintendo,Nintendo Switch
Case Capa Compativel Nintendo Switch + Pelicula Vidro + Grip Pokebola,R$,181.44,no Pix ,ou 249.00 em 5x de 49.80 sem juros,-,Nao,Nao,Nao,Nintendo,Nintendo Switch
Protetor de tela Bionik para Nintendo Switch BNK-9039,R$,129.9,no Pix ,ou 129.00 em 2x de 64.50 sem juros,-,Nao,Nao,Nao,Nintendo,Nintendo Switch
"Jogo Super Mario Bros. Wonder, Nintendo Switch - HBCPAQMXA",R$,349.9,no Pix ,ou 106.44 em 2x de 53.22 sem juros,-,Nao,Nao,Nao,Nintendo,Nintendo Switch
Película de vidro mini temperado tela Nintendo Switch Lite,R$,24.47,no Pix ,ou 235.80 em 5x de 47.16 sem juros,-,Nao,Sim,Nao,Nintendo,Nintendo Switch
Conversor Vídeo Compatível Com Nintendo Switch Tipo-C Para Hdmi Usb 3.0,R$,118.7,no Pix ,ou 95.00 em 2x de 47.50 sem juros,-,Nao,Nao,Nao,Nintendo,Nintendo Switch
Case Compatível Nintendo Switch Lite Bolsa Estojo - Modelo 064,R$,39.99,no Pix ,ou 99.00 em 2x de 49.50 sem juros,-,Nao,Sim,Nao,Nintendo,Nintendo Switch
Teclado Chatpad Wireless Para Nintendo Switch Joy-con 54 Teclas Preto,R$,178.1,no Pix ,ou 239.00 em 5x de 47.80 sem juros,-,Nao,Nao,Sim,Nintendo,Nintendo Switch
Case Compatível Nintendo Switch Bolsa Estojo - Zelda Tears of the Kingdom Edition,R$,39.99,no Pix ,ou 372.80 em 6x de 62.13 sem juros,-,Nao,Nao,Nao,Nintendo,Nintendo Switch
Porta Jogos Nintendo Switch - Question Block - Super Mario,R$,74.9,no Pix ,ou 179.00 em 3x de 59.67 sem juros,-,Nao,Nao,Nao,Nintendo,Nintendo Switch
Case Bolsa Bag Estojo Nintendo Switch Preto Azul Vermelho,R$,57.6,no Pix ,ou 209.80 em 4x de 52.45 sem juros,-,Nao,Nao,Nao,Nintendo,Nintendo Switch
Fatal Frame: Maiden of Black Water - Switch,R$,335.52,no Pix ,ou 443.80 em 6x de 73.97 sem juros,-,Nao,Nao,Nao,Nintendo,Nintendo Switch
Kit Case Compatível com Nintendo Switch Oled Pelicula Grip Silicone Joy Con,R$,171.84,no Pix ,ou 349.00 em 7x de 49.86 sem juros,-,Sim,Nao,Nao,Nintendo,Nintendo Switch
Cars 3 : Driven To Win - Switch,R$,188.82,no Pix ,ou 384.80 em 6x de 64.13 sem juros,-,Nao,Nao,Nao,Nintendo,Nintendo Switch
Sonic Frontiers - Switch,R$,399.42,no Pix ,ou 433.80 em 6x de 72.30 sem juros,-,Nao,Nao,Nao,Nintendo,Nintendo Switch
Super Mario Bros Wonder para Nintendo,R$,349.0,no Pix ,ou 197.89 em 4x de 49.47 sem juros,-,Nao,Nao,Nao,Nintendo,Nintendo Switch
Super Mario Bros. Wonder - Switch,R$,346.32,no Pix ,ou 149.00 em 3x de 49.67 sem juros,-,Nao,Nao,Nao,Nintendo,Nintendo Switch
Sonic Superstars - Switch,R$,390.42,no Pix ,ou 159.00 em 3x de 53.00 sem juros,-,Nao,Nao,Nao,Nintendo,Nintendo Switch
Controle Sem Fio Compatível Com Nintendo Switch Pro Computador Android,R$,178.1,no Pix ,ou 308.80 em 6x de 51.47 sem juros,-,Nao,Nao,Nao,Nintendo,Nintendo Switch
Case Capa Compatível com Nintendo Switch + Película Vidro Oled + 4 Grips Zelda + Par Silicone Joycon,R$,171.84,no Pix ,ou 249.00 em 5x de 49.80 sem juros,-,Sim,Nao,Nao,Nintendo,Nintendo Switch
Case Bolsa Bag Estojo De Viagem Nintendo Switch Varias Cores,R$,57.49,no Pix ,ou 299.00 em 6x de 49.83 sem juros,-,Nao,Nao,Nao,Nintendo,Nintendo Switch
Kit 2 Hand Grips Suportes Para Joycons Nintendo Switch,R$,42.71,no Pix ,ou 259.00 em 5x de 51.80 sem juros,-,Nao,Nao,Nao,Nintendo,Nintendo Switch
Case Bolsa Bag Estojo Nintendo Switch Preto Azul Vermelho,R$,57.49,no Pix ,ou 149.00 em 3x de 49.67 sem juros,-,Nao,Nao,Nao,Nintendo,Nintendo Switch
2 Hand Grip Confort Para Joycon Analógico Compativel com Nintendo Switch Oled,R$,149.0,no Pix ,ou 149.00 em 3x de 49.67 sem juros,-,Sim,Nao,Nao,Nintendo,Nintendo Switch
Adesivo Compatível Nintendo Switch Oled Skin - Super Mario,R$,49.99,no Pix ,ou 179.00 em 3x de 59.67 sem juros,-,Sim,Nao,Nao,Nintendo,Nintendo Switch
Capa Case Acrílico Transparente Proteção Grips Compativel com Nintendo Switch Lite,R$,159.0,no Pix ,ou 119.90 em 2x de 59.95 sem juros,-,Nao,Sim,Nao,Nintendo,Nintendo Switch
Case Compatível Nintendo Switch Lite Bolsa Estojo - Modelo 016,R$,39.99,no Pix ,ou 95.49 em 2x de 47.75 sem juros,-,Nao,Sim,Nao,Nintendo,Nintendo Switch
The Witcher 3: Wild Hunt - Switch,R$,277.92,no Pix ,ou 349.90 em 4x de 87.48 sem juros,-,Nao,Nao,Nao,Nintendo,Nintendo Switch
Case Compatível Nintendo Switch Bolsa Estojo - Animal Crossing,R$,39.99,no Pix ,ou 249.00 em 5x de 49.80 sem juros,-,Nao,Nao,Nao,Nintendo,Nintendo Switch
Headset Gamer Nemesis NM-1017,R$,189.71,no Pix ,ou 132.07 em 2x de 66.04 sem juros,-,Nao,Nao,Nao,Nintendo,Nintendo Switch
Bolsa Capa Case Transporte Proteção Compativel com Nintendo Switch Lite,R$,249.0,no Pix ,ou 376.80 em 6x de 62.80 sem juros,-,Nao,Sim,Nao,Nintendo,Nintendo Switch
Capa Case Proteção Tpu Macio Joycon Grip Compativel com Nintendo Switch Oled,R$,299.0,no Pix ,ou 249.00 em 5x de 49.80 sem juros,-,Sim,Nao,Nao,Nintendo,Nintendo Switch
Bolsa Case Transporte Pelicula Grips Proteção Compativel com Nintendo Switch Oled,R$,259.0,no Pix ,ou 357.80 em 2x de 178.90 sem juros,-,Sim,Nao,Nao,Nintendo,Nintendo Switch
Capa Case Proteção Tpu Macio Joycon Grip Compativel com Nintendo Switch,R$,149.0,no Pix ,ou 179.00 em 3x de 59.67 sem juros,-,Nao,Nao,Nao,Nintendo,Nintendo Switch
Capa Case Tpu Macio Transparente Proteção Joycon Compativel Nintendo Switch Oled,R$,149.0,no Pix ,ou 399.70 em 6x de 66.62 sem juros,-,Sim,Nao,Nao,Nintendo,Nintendo Switch
Kit Case Compatível com Nintendo Switch Oled Pelicula Grip Silicone Joy Con,R$,171.84,no Pix ,ou 109.70 em 2x de 54.85 sem juros,-,Sim,Nao,Nao,Nintendo,Nintendo Switch
Fone Headset C/microfone Nintendo Switch Jogos Online,R$,115.1,no Pix ,ou 374.80 em 6x de 62.47 sem juros,-,Nao,Nao,Nao,Nintendo,Nintendo Switch
Case Bolsa Estojo Nintendo Switch Azul + Película Vidro,R$,91.67,no Pix ,ou 374.80 em 6x de 62.47 sem juros,-,Nao,Nao,Nao,Nintendo,Nintendo Switch
Capa Compatível Nintendo Switch Pro Controle Case - Modelo 060,R$,34.99,no Pix ,ou 325.49 em 7x de 46.50 sem juros,-,Nao,Nao,Nao,Nintendo,Nintendo Switch
Controle Sem Fio Joystick Compativel com Nintendo Switch Joy-Con (L)/(R),R$,312.47,no Pix ,ou 394.80 em 6x de 65.80 sem juros,-,Nao,Nao,Sim,Nintendo,Nintendo Switch
Piofiore: Episodio 1926 - SWITCH,R$,355.32,no Pix ,ou 399.00 em 8x de 49.88 sem juros,-,Nao,Nao,Nao,Nintendo,Nintendo Switch
Jogo Donkey Kong Country: Tropical Freeze - Switch,R$,383.04,no Pix ,ou 399.00 em 8x de 49.88 sem juros,-,Nao,Nao,Nao,Nintendo,Nintendo Switch
Jogo Super Smash Bros. Ultimate - Switch,R$,383.04,no Pix ,ou 109.90 em 2x de 54.95 sem juros,-,Nao,Nao,Nao,Nintendo,Nintendo Switch
Kit Capa de Proteção + 2 Película Vidro para Nintendo Switch,R$,104.41,no Pix ,ou 548.75 em 10x de 54.88 sem juros,-,Nao,Nao,Nao,Nintendo,Nintendo Switch
Controle Nintendo Switch Controller Pro Sem Fio Preto,R$,548.75,no Pix ,ou 296.80 em 6x de 49.47 sem juros,-,Nao,Nao,Nao,Nintendo,Nintendo Switch
Ultra Street Fighter II: The Final Challengers - Switch,R$,267.12,no Pix ,ou 299.00 em 6x de 49.83 sem juros,-,Nao,Nao,Nao,Nintendo,Nintendo Switch
Capa Case e Skin Adesivo Compatível Nintendo Switch Pro Controle - Camuflada Cinza,R$,54.99,no Pix ,ou 365.00 em 8x de 45.63 sem juros,-,Nao,Nao,Nao,Nintendo,Nintendo Switch
Case Capa Estojo Bag Rígida Compatível Nintendo Switch+ Película Vidro Temperado Oled+ 4 Grips+ Tpu,R$,152.64,no Pix ,ou 529.40 em 10x de 52.94 sem juros,-,Sim,Nao,Nao,Nintendo,Nintendo Switch
Capa Case e Skin Adesivo Compatível Nintendo Switch Pro Controle - Zelda Tears of the Kingdom,R$,54.99,no Pix ,ou 499.00 em 10x de 49.90 sem juros,-,Nao,Nao,Nao,Nintendo,Nintendo Switch
Case Compatível Nintendo Switch Bolsa Estojo - Super Mario Bros 3,R$,39.99,no Pix ,ou 279.00 em 6x de 46.50 sem juros,-,Nao,Nao,Nao,Nintendo,Nintendo Switch
Case Compatível Com Nintendo Switch Lite Bolsa Estojo Premium Alça Mão,R$,75.74,no Pix ,ou 129.70 em 2x de 64.85 sem juros,-,Nao,Sim,Nao,Nintendo,Nintendo Switch
Jogo Pokémon Legends: Arceus Nintendo Switch Mídia Física,R$,278.07,no Pix ,ou 376.80 em 6x de 62.80 sem juros,-,Nao,Nao,Nao,Nintendo,Nintendo Switch
Case Compatível Nintendo Switch Lite Bolsa Estojo - Bowser s Fury,R$,39.99,no Pix ,ou 324.99 em 7x de 46.43 sem juros,-,Nao,Sim,Nao,Nintendo,Nintendo Switch
Pokémon Violet - Nintendo Switch - Versão EU,R$,365.0,no Pix ,ou 149.00 em 3x de 49.67 sem juros,-,Nao,Nao,Nao,Nintendo,Nintendo Switch
Grip De Mão Nintendo Switch Para Controle Joy-con - Dobe,R$,42.71,no Pix ,ou 159.00 em 3x de 53.00 sem juros,-,Nao,Nao,Sim,Nintendo,Nintendo Switch
Capa Compatível Nintendo Switch Pro Controle Case - Radioativo,R$,34.99,no Pix ,ou 419.90 em 9x de 46.66 sem juros,-,Nao,Nao,Nao,Nintendo,Nintendo Switch
"Headset Gamer HyperX Cloud III, DTS, Drivers 53mm, USB, PC, PS5, PS4, XBOX Series xis, Xbox One, Nintendo Switch, Mobile, Preto e Vermelho - 727A9AA",R$,449.99,no Pix ,ou 349.90 em 7x de 49.99 sem juros,-,Nao,Nao,Nao,Nintendo,Nintendo Switch
Bolsa Transporte Capa Case Viagem Maleta Premium Compativel com Nintendo Switch Ou Oled,R$,499.0,no Pix ,ou 205.80 em 4x de 51.45 sem juros,-,Sim,Nao,Nao,Nintendo,Nintendo Switch
Capa Anti Poeira e Skin Compatível Nintendo Switch Oled - Zelda Tears of the Kingdom Edition,R$,79.99,no Pix ,ou 229.00 em 5x de 45.80 sem juros,-,Sim,Nao,Nao,Nintendo,Nintendo Switch
Case Protetor Nintendo Switch Lite + Película + Thumb,R$,53.27,no Pix ,ou 374.80 em 6x de 62.47 sem juros,-,Nao,Sim,Nao,Nintendo,Nintendo Switch
Case Compatível Nintendo Switch Bolsa Estojo - Madeira,R$,39.99,no Pix ,ou 139.98 em 3x de 46.66 sem juros,-,Nao,Nao,Nao,Nintendo,Nintendo Switch
Bolsa Capa Case Grip Transporte Proteção Premium Compativel com Nintendo Switch Oled,R$,299.0,no Pix ,ou 299.00 em 6x de 49.83 sem juros,-,Sim,Nao,Nao,Nintendo,Nintendo Switch
Adesivo Compatível Nintendo Switch Lite Skin - Modelo 064,R$,44.99,no Pix ,ou 374.80 em 6x de 62.47 sem juros,-,Nao,Sim,Nao,Nintendo,Nintendo Switch
Mario Party Superstars (I) - Switch,R$,337.32,no Pix ,ou 109.89 em 2x de 54.95 sem juros,-,Nao,Nao,Nao,Nintendo,Nintendo Switch
Case Compatível Nintendo Switch Bolsa Estojo - Modelo 047,R$,39.99,no Pix ,ou 404.99 em 8x de 50.62 sem juros,-,Nao,Nao,Nao,Nintendo,Nintendo Switch
Capa De Silicone Tpu Para Nintendo Switch - Alta Proteção,R$,61.66,no Pix ,ou 95.39 em 2x de 47.70 sem juros,-,Nao,Nao,Nao,Nintendo,Nintendo Switch
Dock Base Estação de Carregamento Para 4 Controle Joy-con de Nintendo Switch Lite Oled - Armazenamento Para 8 Jogos Marron,R$,98.9,no Pix ,ou 249.00 em 5x de 49.80 sem juros,-,Sim,Sim,Sim,Nintendo,Nintendo Switch
Pelicula De Vidro Temperado 9h Para Tela Nintendo Switch Oled,R$,27.73,no Pix ,ou 219.00 em 4x de 54.75 sem juros,-,Sim,Nao,Nao,Nintendo,Nintendo Switch
Fonte Type-c Para Dock Nintendo Switch Thinkpad 65w le09,R$,96.33,no Pix ,ou 109.89 em 2x de 54.95 sem juros,-,Nao,Nao,Nao,Nintendo,Nintendo Switch
Par Raquete Tênis Nintendo Switch Joy-con Mario Ping-Pong,R$,64.25,no Pix ,ou 199.90 em 4x de 49.98 sem juros,-,Nao,Nao,Sim,Nintendo,Nintendo Switch
Par De Grip Joycon Controller Nintendo Switch Console Game,R$,42.71,no Pix ,ou 386.66 em 8x de 48.33 sem juros,-,Nao,Nao,Nao,Nintendo,Nintendo Switch
Case Bag Bolsa Estojo Viagem Proteção Nintendo Switch Lite,R$,45.97,no Pix ,ou 200.80 em 4x de 50.20 sem juros,-,Nao,Sim,Nao,Nintendo,Nintendo Switch
Jogo The Legend Of Zelda Tears Of The Kingdom Nintendo Switch,R$,388.79,no Pix ,ou 251.80 em 5x de 50.36 sem juros,-,Nao,Nao,Nao,Nintendo,Nintendo Switch
"Pelicula 0,3mm 9h Vidro Temperado Anti Risco Compativel com Nintendo Switch Padrao",R$,39.0,no Pix ,ou 399.00 em 5x de 79.80 sem juros,-,Nao,Nao,Nao,Nintendo,Nintendo Switch
Capa Anti Poeira Compatível Nintendo Switch - Modelo 066,R$,44.99,no Pix ,ou 119.70 em 2x de 59.85 sem juros,-,Nao,Nao,Nao,Nintendo,Nintendo Switch
Dock Carregador Joycon para Nintendo Switch 4 Slots Compacto,R$,95.39,no Pix ,ou 599.00 em 7x de 85.57 sem juros,-,Nao,Nao,Nao,Nintendo,Nintendo Switch
Bolsa Transporte Capa Case Animal Crossing Compativel com Nintendo Switch Lite,R$,249.0,no Pix ,ou 179.00 em 3x de 59.67 sem juros,-,Nao,Sim,Nao,Nintendo,Nintendo Switch
Skin Compatível Nintendo Switch Adesivo - Super Mario Bros. Wonder,R$,49.99,no Pix ,ou 149.00 em 3x de 49.67 sem juros,-,Nao,Nao,Nao,Nintendo,Nintendo Switch
Capa Anti Poeira e Skin Compatível Nintendo Switch - Modelo 003,R$,79.0,no Pix ,ou 189.00 em 4x de 47.25 sem juros,-,Nao,Nao,Nao,Nintendo,Nintendo Switch
Case Capa Proteção Tpu Grip Ergonômico Joycon Compativel com Nintendo Switch Oled,R$,219.0,no Pix ,ou 550.00 em 10x de 55.00 sem juros,-,Sim,Nao,Nao,Nintendo,Nintendo Switch
Capa Case Estojo Para Nintendo Switch Console + Pelicula Vdr,R$,75.73,no Pix ,ou 119.00 em 2x de 59.50 sem juros,-,Nao,Nao,Nao,Nintendo,Nintendo Switch
"Case Bolsa Estojo De Viagem Capa De Proteção Nintendo Switch, Lite, Oled e 3DS Preta",R$,98.9,no Pix ,ou 811.75 em 10x de 81.18 sem juros,-,Sim,Sim,Nao,Nintendo,Nintendo Switch
Estojo Bag Temático para Nintendo Switch Oled Pokemon Zelda,R$,189.91,no Pix ,ou 129.90 em 2x de 64.95 sem juros,-,Sim,Nao,Nao,Nintendo,Nintendo Switch
Jogo Mario Kart 8 Deluxe Nintendo Switch Físico Nacional,R$,386.66,no Pix ,ou 119.00 em 2x de 59.50 sem juros,-,Nao,Nao,Nao,Nintendo,Nintendo Switch
Pocky & Rocky Reshrined - SWITCH,R$,180.72,no Pix ,ou 299.99 em 6x de 50.00 sem juros,-,Nao,Nao,Nao,Nintendo,Nintendo Switch
Monster Hunter Stories 2: Wings of Ruin - Switch,R$,226.62,no Pix ,ou 224.80 em 4x de 56.20 sem juros,-,Nao,Nao,Nao,Nintendo,Nintendo Switch
Controle para Nintendo Switch sem Fio Joy-Con,R$,383.04,no Pix ,ou 398.80 em 3x de 132.93 sem juros,-,Nao,Nao,Sim,Nintendo,Nintendo Switch
Case Temático Pikachu Nintendo Switch,R$,119.7,no Pix ,ou 149.00 em 3x de 49.67 sem juros,-,Nao,Nao,Nao,Nintendo,Nintendo Switch
Case Capa Estojo Bolsa Compativel Nintendo switch,R$,62.4,no Pix ,ou 149.00 em 3x de 49.67 sem juros,-,Nao,Nao,Nao,Nintendo,Nintendo Switch
Capa De Transporte Estojo P/ Poke Ball Plus Nintendo Switch,R$,29.6,no Pix ,ou 268.80 em 5x de 53.76 sem juros,-,Nao,Nao,Nao,Nintendo,Nintendo Switch
Case Bolsa Transporte Mario Compatível com Nintendo Switch Ou Nintendo Switch Oled,R$,599.0,no Pix ,ou 269.00 em 5x de 53.80 sem juros,-,Sim,Nao,Nao,Nintendo,Nintendo Switch
Case Compatível Nintendo Switch Bolsa Estojo - Fifa 20,R$,39.99,no Pix ,ou 119.00 em 2x de 59.50 sem juros,-,Nao,Nao,Nao,Nintendo,Nintendo Switch
Capa Anti Poeira e Skin Compatível Nintendo Switch - Splatoon 2,R$,79.0,no Pix ,ou 295.00 em 6x de 49.17 sem juros,-,Nao,Nao,Nao,Nintendo,Nintendo Switch
Skin Compatível Nintendo Switch Adesivo - Radioativo,R$,49.99,no Pix ,ou 304.99 em 6x de 50.83 sem juros,-,Nao,Nao,Nao,Nintendo,Nintendo Switch
Case Capa Compatível com Nintendo Switch + Película Vidro Oled + 4 Grips Zelda + Par Silicone Joycon,R$,171.84,no Pix ,ou 429.99 em 6x de 71.67 sem juros,-,Sim,Nao,Nao,Nintendo,Nintendo Switch
Capa Case Proteção Tpu Macio Joycon Grip Compativel com Nintendo Switch,R$,149.0,no Pix ,ou 249.00 em 5x de 49.80 sem juros,-,Nao,Nao,Nao,Nintendo,Nintendo Switch
Bolsa Película Compativel com Nintendo Switch Case Capa Animal Crossing!!,R$,239.0,no Pix ,ou 239.00 em 5x de 47.80 sem juros,-,Nao,Nao,Nao,Nintendo,Nintendo Switch
Grip Thumb Kontrol Freek para Controle Nintendo Switch Pro,R$,74.19,no Pix ,ou 429.99 em 6x de 71.67 sem juros,-,Nao,Nao,Nao,Nintendo,Nintendo Switch
Adesivo Compatível Nintendo Switch Oled Skin - Radioativo,R$,49.99,no Pix ,ou 239.00 em 5x de 47.80 sem juros,-,Sim,Nao,Nao,Nintendo,Nintendo Switch
Controle Nintendo Pro Cinza - Nintendo Switch (BR),R$,429.99,no Pix ,ou 304.99 em 6x de 50.83 sem juros,-,Nao,Nao,Nao,Nintendo,Nintendo Switch
Case Compatível Nintendo Switch Bolsa Estojo - Dragon Quest,R$,39.99,no Pix ,ou 267.80 em 5x de 53.56 sem juros,-,Nao,Nao,Nao,Nintendo,Nintendo Switch
Case Compatível Nintendo Switch Lite Bolsa Estojo - Modelo 005,R$,39.99,no Pix ,ou 233.80 em 5x de 46.76 sem juros,-,Nao,Sim,Nao,Nintendo,Nintendo Switch
Bolsa Capa Case Proteção Transporte Grip Joycon Compativel com Nintendo Switch Lite,R$,239.0,no Pix ,ou 324.99 em 7x de 46.43 sem juros,-,Nao,Sim,Nao,Nintendo,Nintendo Switch
Jogo Sonic Frontiers Nintendo Switch,R$,292.79,no Pix ,ou 399.00 em 8x de 49.88 sem juros,-,Nao,Nao,Nao,Nintendo,Nintendo Switch
Capa Anti Poeira e Skin Compatível Nintendo Switch - Mario Kart 8,R$,79.0,no Pix ,ou 619.90 em 10x de 61.99 sem juros,-,Nao,Nao,Nao,Nintendo,Nintendo Switch
Capa Compatível Nintendo Switch Pro Controle Case - Pikmin,R$,34.99,no Pix ,ou 149.00 em 3x de 49.67 sem juros,-,Nao,Nao,Nao,Nintendo,Nintendo Switch
Capa Anti Poeira e Skin Compatível Nintendo Switch Oled - New Super Mario Bros. U,R$,79.0,no Pix ,ou 349.89 em 7x de 49.98 sem juros,-,Sim,Nao,Nao,Nintendo,Nintendo Switch
Case Compatível Com Nintendo Switch Estojo Proteção Viagem + 2 películas,R$,85.44,no Pix ,ou 119.00 em 2x de 59.50 sem juros,-,Nao,Nao,Nao,Nintendo,Nintendo Switch
Case Compatível Nintendo Switch Bolsa Estojo - Batman Comics,R$,39.99,no Pix ,ou 109.00 em 2x de 54.50 sem juros,-,Nao,Nao,Nao,Nintendo,Nintendo Switch
Tony Hawk's Pro Skater 1+2 - Switch,R$,241.02,no Pix ,ou 355.80 em 6x de 59.30 sem juros,-,Nao,Nao,Nao,Nintendo,Nintendo Switch
FONTE CARREGADOR UNIVERSAL PARA CONECTOR USB-C COM NOTEBOOK / TABLET / NINTENDO SWITCH / SMARTPHONE 65w le09,R$,96.33,no Pix ,ou 209.80 em 4x de 52.45 sem juros,-,Nao,Nao,Nao,Nintendo,Nintendo Switch
Crash Team Racing Nitro Fueled - Switch,R$,210.42,no Pix ,ou 485.89 em 10x de 48.59 sem juros,-,Nao,Nao,Nao,Nintendo,Nintendo Switch
Jogo Pikmin 4 Nintendo Switch,R$,311.99,no Pix ,ou 316.99 em 4x de 79.25 sem juros,-,Nao,Nao,Nao,Nintendo,Nintendo Switch
Case Compatível Nintendo Switch Lite Bolsa Estojo - Hollow Knight,R$,39.99,no Pix ,ou 336.80 em 6x de 56.13 sem juros,-,Nao,Sim,Nao,Nintendo,Nintendo Switch
Capa Anti Poeira e Skin Compatível Nintendo Switch Oled - Nintendinho Nes,R$,79.0,no Pix ,ou 226.80 em 5x de 45.36 sem juros,-,Sim,Nao,Nao,Nintendo,Nintendo Switch
Jogo Kirby And The Forgotten Land - Switch,R$,383.04,no Pix ,ou 249.00 em 5x de 49.80 sem juros,-,Nao,Nao,Nao,Nintendo,Nintendo Switch
Case Compatível Nintendo Switch Lite Bolsa Estojo - Modelo 049,R$,39.99,no Pix ,ou 356.80 em 6x de 59.47 sem juros,-,Nao,Sim,Nao,Nintendo,Nintendo Switch
Bolsa original nintendo switch lite animal crossing case,R$,601.3,no Pix ,ou 129.00 em 2x de 64.50 sem juros,-,Nao,Sim,Nao,Nintendo,Nintendo Switch
Capa Anti Poeira Compatível Nintendo Switch - Modelo 057,R$,44.99,no Pix ,ou 249.99 em 5x de 50.00 sem juros,-,Nao,Nao,Nao,Nintendo,Nintendo Switch
Cooler Usb Nintendo Switch OLED Exaustor De Calor Refrigeração Fan Branco,R$,108.8,no Pix ,ou 169.00 em 3x de 56.33 sem juros,-,Sim,Nao,Nao,Nintendo,Nintendo Switch
Case Compatível Nintendo Switch Lite Bolsa Estojo - Final Fantasy Vii: Remake,R$,39.99,no Pix ,ou 159.00 em 3x de 53.00 sem juros,-,Nao,Sim,Nao,Nintendo,Nintendo Switch
Capa Case Proteção Premium Grip Ergonômico Compativel com Nintendo Switch Oled,R$,149.0,no Pix ,ou 239.00 em 5x de 47.80 sem juros,-,Sim,Nao,Nao,Nintendo,Nintendo Switch
