titulo,moeda,preco_promo,condition_promo,parcelado,memoria,oled,lite,joy_con,marca,console
"Console Nintendo Switch Oled com Joy-Con, Branco - HBGSKAAA2",R$,2138.07,no Pix ,ou 2299.00 em 10x de 229.90 sem juros,-,Sim,Nao,Sim,Nintendo,Nintendo Switch
Nintendo Switch 32GB 1 Par Joy-con + Mario Kart 8,R$,2521.03,no Pix ,ou 2599.00 em 7x de 371.29 sem juros,32GB,Nao,Nao,Sim,Nintendo,Nintendo Switch
Nintendo Switch 64GB Oled Edição Especial,R$,2819.06,no Pix ,ou 2999.00 em 7x de 428.43 sem juros,64GB,Sim,Nao,Nao,Nintendo,Nintendo Switch
"Nintendo Switch Lite 32GB Coral 5,5”",R$,1648.03,no Pix ,ou 1699.00 em 10x de 169.90 sem juros,32GB,Nao,Sim,Nao,Nintendo,Nintendo Switch
"Nintendo Switch Lite 32 GB Turquesa Standard LCD 5,5""",R$,1339.0,no Pix ,ou 1339.00 em 10x de 133.90 sem juros,32 GB,Nao,Sim,Nao,Nintendo,Nintendo Switch
Nintendo Switch Oled 64GB 1x Joy-Con Branco Standard - HEGSKAAAA,R$,2580.0,no Pix ,ou 2580.00 em 10x de 258.00 sem juros,64GB,Sim,Nao,Sim,Nintendo,Nintendo Switch
Nintendo Switch 32GB HAC-001-01 1 Controle Joy-Con,R$,2443.06,no Pix ,ou 2599.00 em 10x de 259.90 sem juros,32GB,Nao,Nao,Sim,Nintendo,Nintendo Switch
"Nintendo Switch Lite 32 GB Coral Standard LCD 5,5""",R$,1245.27,no Pix ,ou 1339.00 em 10x de 133.90 sem juros,32 GB,Nao,Sim,Nao,Nintendo,Nintendo Switch
Console Nintendo Switch 32GB com JoyCon Azul e Vermelho Neon V2,R$,2207.99,no Pix ,ou 2299.99 em 10x de 230.00 sem juros,32GB,Nao,Nao,Nao,Nintendo,Nintendo Switch
Console Nintendo Switch Oled 64gb - Branco,R$,2339.99,no Pix ,ou 2599.99 em 10x de 260.00 sem juros,-,Sim,Nao,Nao,Nintendo,Nintendo Switch
Console Nintendo Switch 32GB com JoyCon Azul e Vermelho Neon V2 HBDSKABH1,R$,1933.47,no Pix ,ou 2079.00 em 10x de 207.90 sem juros,32GB,Nao,Nao,Nao,Nintendo,Nintendo Switch
Console Nintendo Switch Mario Kart 8 Digital Deluxe Joy-Con Neon,R$,2399.99,no Pix ,ou 2499.99 em 10x de 250.00 sem juros,-,Nao,Nao,Sim,Nintendo,Nintendo Switch
Nintendo Switch 32GB 1 Controle Joy-Con,R$,2299.08,no Pix ,ou 2499.00 em 10x de 249.90 sem juros,32GB,Nao,Nao,Sim,Nintendo,Nintendo Switch
New Nintendo Switch Oled 64gb Branco,R$,2339.99,no Pix ,ou 2599.99 em 10x de 260.00 sem juros,-,Sim,Nao,Nao,Nintendo,Nintendo Switch
Nintendo Switch 64GB 2 Controles Joy-con,R$,2521.03,no Pix ,ou 2599.00 em 10x de 259.90 sem juros,64GB,Nao,Nao,Sim,Nintendo,Nintendo Switch
Nintendo Switch 32GB 1 Controle Joy-Con,R$,2299.08,no Pix ,ou 2499.00 em 10x de 249.90 sem juros,32GB,Nao,Nao,Sim,Nintendo,Nintendo Switch
Nintendo Switch 32GB HAC-001-01 1 Controle Joy-Con,R$,2443.06,no Pix ,ou 2599.00 em 10x de 259.90 sem juros,32GB,Nao,Nao,Sim,Nintendo,Nintendo Switch
"Console De Videogames Nintendo Switch Oled 17,8 Cm (7 ) 64 Gb Ecrã Táctil Wi-fi Branco",R$,2339.99,no Pix ,ou 2599.99 em 10x de 260.00 sem juros,64 Gb,Sim,Nao,Nao,Nintendo,Nintendo Switch
Nintendo Switch Oled 64gb Standard Cor Branco E Preto,R$,2339.99,no Pix ,ou 2599.99 em 3x de 866.66 sem juros,-,Sim,Nao,Nao,Nintendo,Nintendo Switch
Nintendo Switch Lite Azul-Turquesa,R$,1424.91,no Pix ,ou 1499.90 em 10x de 149.99 sem juros,-,Nao,Sim,Nao,Nintendo,Nintendo Switch
"Nintendo Switch 32GB, 1x Joycon, Cinza - HAD S KAAA2 BRA",R$,2507.89,no Pix ,ou 2507.89 em 10x de 250.79 sem juros,32GB,Nao,Nao,Nao,Nintendo,Nintendo Switch
Nintendo Switch 32GB 1 Par Joy-con + Mario Kart 8,R$,2948.9,no Pix ,ou 2948.90 em 10x de 294.89 sem juros,32GB,Nao,Nao,Sim,Nintendo,Nintendo Switch
Console Nintendo Switch Azul e Vermelho com Mario Kart 8,R$,2999.0,no Pix ,ou 2999.00 em 10x de 299.90 sem juros,-,Nao,Nao,Nao,Nintendo,Nintendo Switch
"Console Nintendo Switch Lite com Tela 5,5 LCD 32GB Turquesa",R$,1499.9,no Pix ,ou 1499.90 em 10x de 149.99 sem juros,32GB,Nao,Sim,Nao,Nintendo,Nintendo Switch
Nintendo Switch Pro Controller Preto,R$,427.0,no Pix ,ou 427.00 em 9x de 47.44 sem juros,-,Nao,Nao,Nao,Nintendo,Nintendo Switch
"Console Nintendo Switch Lite 32GB Coral Tela 5,5 Portatil",R$,1399.9,no Pix ,ou 1399.90 em 10x de 139.99 sem juros,32GB,Nao,Sim,Nao,Nintendo,Nintendo Switch
Dock para Nintendo Switch Super Mario Bros,R$,169.9,no Pix ,ou 169.90 em 3x de 56.63 sem juros,-,Nao,Nao,Nao,Nintendo,Nintendo Switch
"Nintendo Switch Lite 32 GB Azul Standard LCD 5,5""",R$,1339.0,no Pix ,ou 1339.00 em 10x de 133.90 sem juros,32 GB,Nao,Sim,Nao,Nintendo,Nintendo Switch
Console Nintendo Switch Oled Branco - Nintendo,R$,2469.89,no Pix ,ou 2469.89 em 10x de 246.99 sem juros,-,Sim,Nao,Nao,Nintendo,Nintendo Switch
Console Nintendo Switch Mario Kart 8 Deluxe Bundle (Full Game Download + 3 Meses Nintendo Switch Online Membership Incluso) NINTENDO,R$,2713.82,no Pix ,ou 2713.82 em 10x de 271.38 sem juros,-,Nao,Nao,Nao,Nintendo,Nintendo Switch
Console Nintendo Switch Oled Zelda Tears Of The Kingdom Edição Especial,R$,2721.51,no Pix ,ou 3023.90 em 10x de 302.39 sem juros,-,Sim,Nao,Nao,Nintendo,Nintendo Switch
Alça de Pulso e Perna para Jogos do Nintendo Switch/Oled,R$,75.73,no Pix ,ou 243.79 em 5x de 48.76 sem juros,-,Sim,Nao,Nao,Nintendo,Nintendo Switch
Dock TV Nintendo Switch Stand Suporte,R$,243.79,no Pix ,ou 2999.99 em 6x de 500.00 sem juros,-,Nao,Nao,Nao,Nintendo,Nintendo Switch
Console Nintendo Switch OLED Zelda Tears of the Kingdom,R$,2999.99,no Pix ,ou 3499.00 em 10x de 349.90 sem juros,-,Sim,Nao,Nao,Nintendo,Nintendo Switch
Console Nintendo Switch OLED 64gb Edição Mário Vermelho,R$,3499.0,no Pix ,ou 2915.99 em 10x de 291.60 sem juros,-,Sim,Nao,Nao,Nintendo,Nintendo Switch
Nintendo Switch 32GB 1 Par Joy-con + Mario Kart 8,R$,2915.99,no Pix ,ou 2959.00 em 10x de 295.90 sem juros,32GB,Nao,Nao,Sim,Nintendo,Nintendo Switch
Console Nintendo Switch Oled Vermelho - Edição Especial Super Mário - Nintendo,R$,2959.0,no Pix ,ou 2944.99 em 10x de 294.50 sem juros,-,Sim,Nao,Nao,Nintendo,Nintendo Switch
Nintendo Switch 32GB 1 Par Joy-con + Mario Kart 8,R$,2944.99,no Pix ,ou 3387.24 em 10x de 338.72 sem juros,32GB,Nao,Nao,Sim,Nintendo,Nintendo Switch
Console Nintendo Switch 32GB+ Controle Jay-Con Cinza,R$,3251.75,no Pix ,ou 2948.90 em 10x de 294.89 sem juros,32GB,Nao,Nao,Nao,Nintendo,Nintendo Switch
Nintendo Switch 32GB 1 Par Joy-con + Mario Kart 8,R$,2948.9,no Pix ,ou 198.89 em 4x de 49.72 sem juros,32GB,Nao,Nao,Sim,Nintendo,Nintendo Switch
Super Kit 7 in 1 Nintendo Switch para Jogos Sensoriais,R$,190.93,no Pix ,ou 3499.99 em 10x de 350.00 sem juros,-,Nao,Nao,Nao,Nintendo,Nintendo Switch
Nintendo Switch Nacional + Mario Kart 8 Deluxe Digital 32gb,R$,3394.99,no Pix ,ou 2799.90 em 10x de 279.99 sem juros,-,Nao,Nao,Nao,Nintendo,Nintendo Switch
Console Nintendo Switch Lite com Tela 7 OLED 64GB Branco,R$,2799.9,no Pix ,ou 2649.90 em 10x de 264.99 sem juros,64GB,Sim,Sim,Nao,Nintendo,Nintendo Switch
Nintendo Switch Oled 64GB - Branco,R$,2543.9,no Pix ,ou 2599.99 em 10x de 260.00 sem juros,64GB,Sim,Nao,Nao,Nintendo,Nintendo Switch
Nintendo Switch OLED 64GB Standard cor branco e preto,R$,2339.99,no Pix ,ou 2571.00 em 10x de 257.10 sem juros,64GB,Sim,Nao,Nao,Nintendo,Nintendo Switch
Nintendo switch oled - branco,R$,2468.16,no Pix ,ou 3399.89 em 10x de 339.99 sem juros,-,Sim,Nao,Nao,Nintendo,Nintendo Switch
Console Nintendo Switch Oled The Legend of Zelda Tears of The Kingdom - Nintendo,R$,3263.89,no Pix ,ou 2948.90 em 10x de 294.89 sem juros,-,Sim,Nao,Nao,Nintendo,Nintendo Switch
Kit Nintendo Switch 32GB 1 Par Joy-con + Mario,R$,2948.9,no Pix ,ou 2911.90 em 10x de 291.19 sem juros,32GB,Nao,Nao,Sim,Nintendo,Nintendo Switch
Console Nintendo Switch Oled 64GB HBGSKAAA1 WI-FI Bluetooth,R$,2620.71,no Pix ,ou 3558.90 em 10x de 355.89 sem juros,64GB,Sim,Nao,Nao,Nintendo,Nintendo Switch
"Nintendo Switch OLED 7.0"" 64Gb Joy-Con Branco + Jogo Zelda Tears of Kingdom",R$,3558.9,no Pix ,ou 3099.99 em 10x de 310.00 sem juros,64Gb,Sim,Nao,Sim,Nintendo,Nintendo Switch
"Console Nintendo Switch OLED 7.0"" 64GB Branco Nacional",R$,3099.99,no Pix ,ou 2948.90 em 10x de 294.89 sem juros,64GB,Sim,Nao,Nao,Nintendo,Nintendo Switch
Nintendo Switch 32GB 1 Par Joy-con + Mario Kart 8,R$,2948.9,no Pix ,ou 2877.10 em 10x de 287.71 sem juros,32GB,Nao,Nao,Sim,Nintendo,Nintendo Switch
"Console Nintendo Switch OLED com Joy-Con Branco, HBGSKAAA1 NINTENDO",R$,2877.1,no Pix ,ou 3199.00 em 10x de 319.90 sem juros,-,Sim,Nao,Sim,Nintendo,Nintendo Switch
Console Nintendo Switch + Mario Kart Deluxe 8 - HBDSKABL1,R$,3199.0,no Pix ,ou 185.49 em 4x de 46.37 sem juros,-,Nao,Nao,Nao,Nintendo,Nintendo Switch
Video Conversor Hdmi Dock Nintendo Switch Type C Power Input,R$,178.07,no Pix ,ou 3798.99 em 10x de 379.90 sem juros,-,Nao,Nao,Nao,Nintendo,Nintendo Switch
Nintendo Switch 32GB HAC-001-01 1 Controle Joy-Con,R$,3798.99,no Pix ,ou 2948.90 em 10x de 294.89 sem juros,32GB,Nao,Nao,Sim,Nintendo,Nintendo Switch
Kit 6 em 1 Pokebola Nintendo Switch Estojo Case Almofada Cabo Poke Ball,R$,49.4,no Pix ,ou 2699.90 em 10x de 269.99 sem juros,-,Nao,Nao,Nao,Nintendo,Nintendo Switch
Nintendo Switch 32GB HAC-001-01 1 Controle Joy-Con,R$,3057.99,no Pix ,ou 3057.99 em 10x de 305.80 sem juros,32GB,Nao,Nao,Sim,Nintendo,Nintendo Switch
Taxi Chaos - Switch,R$,169.92,no Pix ,ou 188.80 em 4x de 47.20 sem juros,-,Nao,Nao,Nao,Nintendo,Nintendo Switch
"Grips Thumb Fps Joycon Skull & Co Compativel com Nintendo Switch, Lite ou Oled",R$,99.0,no Pix ,ou 99.00 em 2x de 49.50 sem juros,-,Sim,Sim,Nao,Nintendo,Nintendo Switch
Game Nint Switch Lite 32Gb Usa Coral,R$,2663.52,no Pix ,ou 2864.00 em 10x de 286.40 sem juros,32Gb,Nao,Sim,Nao,Nintendo,Nintendo Switch
Game Nint Switch Lite 32Gb Usa Coral,R$,2577.6,no Pix ,ou 2864.00 em 10x de 286.40 sem juros,32Gb,Nao,Sim,Nao,Nintendo,Nintendo Switch
Nintendo Switch 32GB HAC-001-01 1 Controle Joy-Con,R$,3147.99,no Pix ,ou 3147.99 em 10x de 314.80 sem juros,32GB,Nao,Nao,Sim,Nintendo,Nintendo Switch
Analógico 3d Botão Direcional Joy-con Switch + Switch Lite + Switch OLED Novo!,R$,25.65,no Pix ,ou 99.00 em 2x de 49.50 sem juros,-,Sim,Sim,Sim,Nintendo,Nintendo Switch
Botões A-b-x-y L-r Zl Zr + - Home Joycon Compativel com Nintendo Switch Lite,R$,99.0,no Pix ,ou 3145.99 em 10x de 314.60 sem juros,-,Nao,Sim,Nao,Nintendo,Nintendo Switch
Nintendo Switch 32GB HAC-001-01 1 Controle Joy-Con,R$,3145.99,no Pix ,ou 99.00 em 2x de 49.50 sem juros,32GB,Nao,Nao,Sim,Nintendo,Nintendo Switch
"Grips Thumb Fps Joycon Skull & Co Compativel com Nintendo Switch, Lite ou Oled",R$,99.0,no Pix ,ou 2864.00 em 10x de 286.40 sem juros,-,Sim,Sim,Nao,Nintendo,Nintendo Switch
Kit de manutenção chave y nintendo switch joy-con,R$,77.5,no Pix ,ou 2864.00 em 7x de 409.14 sem juros,-,Nao,Nao,Sim,Nintendo,Nintendo Switch
Game Nint Switch Lite 32Gb Usa Coral,R$,2577.6,no Pix ,ou 3022.90 em 10x de 302.29 sem juros,32Gb,Nao,Sim,Nao,Nintendo,Nintendo Switch
Game Nint Switch Lite 32Gb Usa Coral,R$,2663.52,no Pix ,ou 99.00 em 2x de 49.50 sem juros,32Gb,Nao,Sim,Nao,Nintendo,Nintendo Switch
Console Nintendo Switch Oled,R$,2720.61,no Pix ,ou 99.00 em 2x de 49.50 sem juros,-,Sim,Nao,Nao,Nintendo,Nintendo Switch
Botões A-b-x-y L-r Zl Zr + - Home Joycon Compativel com Nintendo Switch Lite,R$,99.0,no Pix ,ou 2864.00 em 10x de 286.40 sem juros,-,Nao,Sim,Nao,Nintendo,Nintendo Switch
Botões A-b-x-y L-r Zl Zr + - Home Joycon Compativel com Nintendo Switch Lite,R$,99.0,no Pix ,ou 2299.90 em 10x de 229.99 sem juros,-,Nao,Sim,Nao,Nintendo,Nintendo Switch
Game Nint Switch Lite 32Gb Usa Coral,R$,2864.0,no Pix ,ou 2864.00 em 10x de 286.40 sem juros,32Gb,Nao,Sim,Nao,Nintendo,Nintendo Switch
"Nintendo Switch 32GB, 1x Joycon, Neon Azul/Vermelho - HBDSKABA1",R$,2299.9,no Pix ,ou 99.99 em 2x de 50.00 sem juros,32GB,Nao,Nao,Nao,Nintendo,Nintendo Switch
Game Nint Switch Lite 32Gb Usa Coral,R$,2577.6,no Pix ,ou 3300.00 em 10x de 330.00 sem juros,32Gb,Nao,Sim,Nao,Nintendo,Nintendo Switch
Pelicula nintendo switch,R$,99.99,no Pix ,ou 2811.25 em 10x de 281.13 sem juros,-,Nao,Nao,Nao,Nintendo,Nintendo Switch
Console Nintendo Switch Oled 64GB 1X Joy-Con Edição Especial Mario Vermelho,R$,3300.0,no Pix ,ou 9198.00 em 10x de 919.80 sem juros,64GB,Sim,Nao,Sim,Nintendo,Nintendo Switch
Console Nintendo Switch Mario Kart 8 Digital Deluxe Joy-Con Neon,R$,2811.25,no Pix ,ou 2699.99 em 10x de 270.00 sem juros,-,Nao,Nao,Sim,Nintendo,Nintendo Switch
Switch s3028g-pb max,R$,9198.0,no Pix ,ou 339.99 em 7x de 48.57 sem juros,-,Nao,Nao,Nao,Nintendo,Nintendo Switch
"Console Nintendo Switch Oled com Joy-Con, Branco",R$,2591.99,no Pix ,ou 433.80 em 6x de 72.30 sem juros,-,Sim,Nao,Sim,Nintendo,Nintendo Switch
Case Compatível Nintendo Switch Lite Bolsa Estojo - Modelo 053,R$,39.99,no Pix ,ou 280.00 em 6x de 46.67 sem juros,-,Nao,Sim,Nao,Nintendo,Nintendo Switch
Case Bolsa Estojo Nintendo Switch + Película Vidro,R$,75.73,no Pix ,ou 299.80 em 6x de 49.97 sem juros,-,Nao,Nao,Nao,Nintendo,Nintendo Switch
Jogo Kirby and the Forgotten Land - Nintendo Switch Nacional,R$,326.39,no Pix ,ou 348.75 em 7x de 49.82 sem juros,-,Nao,Nao,Nao,Nintendo,Nintendo Switch
Metal Gear Solid: Master Collection Vol.1 - Switch,R$,390.42,no Pix ,ou 299.90 em 2x de 149.95 sem juros,-,Nao,Nao,Nao,Nintendo,Nintendo Switch
Bolsa Bag Compatível Nintendo Switch Com Alça Ombro+ Película De Vidro Temperado Oled,R$,268.8,no Pix ,ou 259.00 em 5x de 51.80 sem juros,-,Sim,Nao,Nao,Nintendo,Nintendo Switch
Star Trek Prodigy: Supernova - Switch,R$,269.82,no Pix ,ou 129.00 em 2x de 64.50 sem juros,-,Nao,Nao,Nao,Nintendo,Nintendo Switch
Jogo The Legend of Zelda: Skyward Sword HD Nintendo Switch Mídia Física,R$,348.75,no Pix ,ou 149.90 em 3x de 49.97 sem juros,-,Nao,Nao,Nao,Nintendo,Nintendo Switch
Capa Anti Poeira e Skin Compatível Nintendo Switch - Modelo 064,R$,79.0,no Pix ,ou 149.00 em 3x de 49.67 sem juros,-,Nao,Nao,Nao,Nintendo,Nintendo Switch
"Jogo Detective Pikachu Returns, Switch - HBCPAVHMA",R$,299.9,no Pix ,ou 119.00 em 2x de 59.50 sem juros,-,Nao,Nao,Nao,Nintendo,Nintendo Switch
Case Bolsa Nintendo Switch Oled V1 V2 Com Espaço Carregador,R$,248.64,no Pix ,ou 238.80 em 5x de 47.76 sem juros,-,Sim,Nao,Nao,Nintendo,Nintendo Switch
Cabo Carregador Usb P/ Nintendo Switch Usb Type C 3.1 Preto,R$,19.7,no Pix ,ou 149.00 em 3x de 49.67 sem juros,-,Nao,Nao,Nao,Nintendo,Nintendo Switch
Capa Case Proteção Tpu Macio Compativel com Nintendo Switch Lite,R$,129.0,no Pix ,ou 237.80 em 5x de 47.56 sem juros,-,Nao,Sim,Nao,Nintendo,Nintendo Switch
Case Compatível Nintendo Switch Lite Bolsa Estojo - Nintendinho Nes,R$,39.99,no Pix ,ou 159.00 em 3x de 53.00 sem juros,-,Nao,Sim,Nao,Nintendo,Nintendo Switch
Capa Anti Poeira e Skin Compatível Nintendo Switch - Zelda Tears of the Kingdom,R$,79.0,no Pix ,ou 149.00 em 3x de 49.67 sem juros,-,Nao,Nao,Nao,Nintendo,Nintendo Switch
Capa Compatível Nintendo Switch Pro Controle Case - Naruto Akatsuki,R$,34.99,no Pix ,ou 238.80 em 5x de 47.76 sem juros,-,Nao,Nao,Nao,Nintendo,Nintendo Switch
Skin Compatível Nintendo Switch Adesivo - Super Mario,R$,49.99,no Pix ,ou 299.90 em 6x de 49.98 sem juros,-,Nao,Nao,Nao,Nintendo,Nintendo Switch
Capa Anti Poeira e Skin Compatível Nintendo Switch Oled - Pikmin,R$,79.0,no Pix ,ou 359.90 em 2x de 179.95 sem juros,-,Sim,Nao,Nao,Nintendo,Nintendo Switch
Película De Hidrogel Compatível Para Nintendo Switch Vários Modelos,R$,22.5,no Pix ,ou 179.00 em 3x de 59.67 sem juros,-,Nao,Nao,Nao,Nintendo,Nintendo Switch
Capa Case Proteção Grip Joycon Tpu Macio Compativel com Nintendo Switch Padrao,R$,159.0,no Pix ,ou 406.90 em 9x de 45.21 sem juros,-,Nao,Nao,Nao,Nintendo,Nintendo Switch
Capa Case Tpu Macio Transparente Proteção Joycon Compativel Nintendo Switch Oled,R$,149.0,no Pix ,ou 99.00 em 2x de 49.50 sem juros,-,Sim,Nao,Nao,Nintendo,Nintendo Switch
Nexomon + Nexomon Extinction - Complete Collection - Switch,R$,214.92,no Pix ,ou 263.80 em 5x de 52.76 sem juros,-,Nao,Nao,Nao,Nintendo,Nintendo Switch
The Diofield Chronicle Nintendo Switch,R$,284.91,no Pix ,ou 374.80 em 6x de 62.47 sem juros,-,Nao,Nao,Nao,Nintendo,Nintendo Switch
Estojo Case Nintendo Switch Oled Cabe Jogos Cabos Acessórios Preta,R$,57.49,no Pix ,ou 189.90 em 4x de 47.48 sem juros,-,Sim,Nao,Nao,Nintendo,Nintendo Switch
Case Capa Mini Nintendo Switch Lite Estojo Viagem Bolsa,R$,45.97,no Pix ,ou 233.90 em 5x de 46.78 sem juros,-,Nao,Sim,Nao,Nintendo,Nintendo Switch
Case Compatível Nintendo Switch Bolsa Estojo - Modelo 005,R$,39.99,no Pix ,ou 489.90 em 10x de 48.99 sem juros,-,Nao,Nao,Nao,Nintendo,Nintendo Switch
Case Compatível Nintendo Switch Lite Bolsa Estojo - Modelo 026,R$,39.99,no Pix ,ou 119.00 em 2x de 59.50 sem juros,-,Nao,Sim,Nao,Nintendo,Nintendo Switch
Harvestella - Switch - Nintendo,R$,345.5,no Pix ,ou 119.00 em 2x de 59.50 sem juros,-,Nao,Nao,Nao,Nintendo,Nintendo Switch
Case Capa Shell Tpu Grip Ergonômico Analógico Joycon Compativel com Nintendo Switch Oled,R$,179.0,no Pix ,ou 249.00 em 5x de 49.80 sem juros,-,Sim,Nao,Nao,Nintendo,Nintendo Switch
Capa Compatível Nintendo Switch Pro Controle Case - Metroid Dread,R$,34.99,no Pix ,ou 199.00 em 4x de 49.75 sem juros,-,Nao,Nao,Nao,Nintendo,Nintendo Switch
Case Compatível Nintendo Switch Lite Bolsa Estojo - Animal Crossing,R$,39.99,no Pix ,ou 133.00 em 2x de 66.50 sem juros,-,Nao,Sim,Nao,Nintendo,Nintendo Switch
The Legend Of Zelda: Breath Of The Wild - Nintendo Switch,R$,390.62,no Pix ,ou 373.80 em 6x de 62.30 sem juros,-,Nao,Nao,Nao,Nintendo,Nintendo Switch
Kit com 2 Suportes de Controle Nintendo Switch Pro,R$,55.05,no Pix ,ou 263.89 em 5x de 52.78 sem juros,-,Nao,Nao,Nao,Nintendo,Nintendo Switch
Case Compatível Nintendo Switch Lite Bolsa Estojo - Super Mario,R$,39.99,no Pix ,ou 391.80 em 6x de 65.30 sem juros,-,Nao,Sim,Nao,Nintendo,Nintendo Switch
Capa Case Proteção Tpu Transparente Glitter Compativel com Nintendo Switch Lite,R$,99.0,no Pix ,ou 269.00 em 5x de 53.80 sem juros,-,Nao,Sim,Nao,Nintendo,Nintendo Switch
Five Nights at Freddy's: Help Wanted - Switch,R$,237.42,no Pix ,ou 179.00 em 3x de 59.67 sem juros,-,Nao,Nao,Nao,Nintendo,Nintendo Switch
The Legend Of Zelda: Breath Of The Wild - Switch,R$,337.32,no Pix ,ou 366.80 em 6x de 61.13 sem juros,-,Nao,Nao,Nao,Nintendo,Nintendo Switch
Caneta nintendo switch original touch screen mario maker 2,R$,184.2,no Pix ,ou 248.80 em 5x de 49.76 sem juros,-,Nao,Nao,Nao,Nintendo,Nintendo Switch
Controle Power-A Pikachu Pop Art P/ Nintendo Switch e PC,R$,233.9,no Pix ,ou 399.90 em 8x de 49.99 sem juros,-,Nao,Nao,Nao,Nintendo,Nintendo Switch
Capa Case e Skin Adesivo Compatível Nintendo Switch Pro Controle - Mario Kart 8,R$,54.99,no Pix ,ou 149.00 em 3x de 49.67 sem juros,-,Nao,Nao,Nao,Nintendo,Nintendo Switch
Capa Anti Poeira Compatível Nintendo Switch - Doom,R$,44.99,no Pix ,ou 399.80 em 3x de 133.27 sem juros,-,Nao,Nao,Nao,Nintendo,Nintendo Switch
Controle Nintendo Pro Cinza - Nintendo Switch (BR),R$,470.3,no Pix ,ou 376.80 em 6x de 62.80 sem juros,-,Nao,Nao,Nao,Nintendo,Nintendo Switch
Case Compatível Nintendo Switch Lite Bolsa Estojo - Pikmin,R$,39.99,no Pix ,ou 374.80 em 6x de 62.47 sem juros,-,Nao,Sim,Nao,Nintendo,Nintendo Switch
Bag Bolsa Estojo Viagem Nintendo Switch Preto + Pelicula,R$,75.73,no Pix ,ou 374.80 em 6x de 62.47 sem juros,-,Nao,Nao,Nao,Nintendo,Nintendo Switch
Capa Protetora Silicone Para Controle Nintendo Switch Joy-con Grip Preto,R$,29.6,no Pix ,ou 337.80 em 6x de 56.30 sem juros,-,Nao,Nao,Sim,Nintendo,Nintendo Switch
Case Compatível Nintendo Switch Lite Bolsa Estojo - Modelo 022,R$,39.99,no Pix ,ou 249.00 em 5x de 49.80 sem juros,-,Nao,Sim,Nao,Nintendo,Nintendo Switch
Capa Anti Poeira Compatível Nintendo Switch - Metroid Dread,R$,44.99,no Pix ,ou 500.00 em 10x de 50.00 sem juros,-,Nao,Nao,Nao,Nintendo,Nintendo Switch
Capa Anti Poeira Compatível Nintendo Switch - Modelo 003,R$,44.99,no Pix ,ou 399.88 em 3x de 133.29 sem juros,-,Nao,Nao,Nao,Nintendo,Nintendo Switch
Case Capa Silicone Nintendo Switch Lite + Pelicula + Grip,R$,53.27,no Pix ,ou 208.89 em 4x de 52.22 sem juros,-,Nao,Sim,Nao,Nintendo,Nintendo Switch
Pokémon Legends: Arceus - Switch,R$,337.32,no Pix ,ou 329.89 em 7x de 47.13 sem juros,-,Nao,Nao,Nao,Nintendo,Nintendo Switch
Capa Anti Poeira e Skin Compatível Nintendo Switch Oled - Luigi's Mansion 3,R$,79.0,no Pix ,ou 109.00 em 2x de 54.50 sem juros,-,Sim,Nao,Nao,Nintendo,Nintendo Switch
AKIBAS TRIP: Undead & Undressed Directors Cut Day1 - Switch,R$,304.02,no Pix ,ou 206.80 em 4x de 51.70 sem juros,-,Nao,Nao,Nao,Nintendo,Nintendo Switch
Bolsa Proteção Capa Case Transporte Mario Para Nintendo Switch Padrao,R$,249.0,no Pix ,ou 177.80 em 3x de 59.27 sem juros,-,Nao,Nao,Nao,Nintendo,Nintendo Switch
Jogo SPLATOON 3 - Nintendo Switch,R$,500.0,no Pix ,ou 116.49 em 2x de 58.25 sem juros,-,Nao,Nao,Nao,Nintendo,Nintendo Switch
Capa Anti Poeira e Skin Compatível Nintendo Switch - Modelo 007,R$,79.0,no Pix ,ou 198.89 em 4x de 49.72 sem juros,-,Nao,Nao,Nao,Nintendo,Nintendo Switch
Cartao micro sd 256gb sandisk nintendo switch - sdsqxao-256g-gnczn,R$,359.89,no Pix ,ou 178.40 em 3x de 59.47 sem juros,-,Nao,Nao,Nao,Nintendo,Nintendo Switch
Adaptador Dock Station Hdmi Cooler USB Para Nintendo Switch,R$,188.0,no Pix ,ou 149.00 em 3x de 49.67 sem juros,-,Nao,Nao,Nao,Nintendo,Nintendo Switch
Case Compatível Nintendo Switch Lite Bolsa Estojo - Bomberman,R$,39.99,no Pix ,ou 249.00 em 5x de 49.80 sem juros,-,Nao,Sim,Nao,Nintendo,Nintendo Switch
Case Compatível Nintendo Switch Bolsa Estojo - Modelo 049,R$,39.99,no Pix ,ou 289.00 em 6x de 48.17 sem juros,-,Nao,Nao,Nao,Nintendo,Nintendo Switch
Jogo Metroid Prime Remastered - Switch,R$,316.69,no Pix ,ou 333.80 em 6x de 55.63 sem juros,-,Nao,Nao,Nao,Nintendo,Nintendo Switch
Capa De Silicone Tpu Para Nintendo Switch - Alta Proteção,R$,61.66,no Pix ,ou 348.75 em 7x de 49.82 sem juros,-,Nao,Nao,Nao,Nintendo,Nintendo Switch
Case Capa Estojo + Película Vidro + 4 Grip Compatível com Nintendo Switch,R$,104.64,no Pix ,ou 189.00 em 4x de 47.25 sem juros,-,Nao,Nao,Nao,Nintendo,Nintendo Switch
Lego Jurassic World - Switch,R$,186.12,no Pix ,ou 185.80 em 4x de 46.45 sem juros,-,Nao,Nao,Nao,Nintendo,Nintendo Switch
Ni No Kuni II Revenant Kingdom - Prince's Edition - Switch,R$,160.02,no Pix ,ou 223.80 em 4x de 55.95 sem juros,-,Nao,Nao,Nao,Nintendo,Nintendo Switch
Case Bag Pokemon Ball Edição Especial Para Nintendo Switch,R$,111.83,no Pix ,ou 179.00 em 3x de 59.67 sem juros,-,Nao,Nao,Nao,Nintendo,Nintendo Switch
Case Nintendo Switch,R$,89.9,no Pix ,ou 179.00 em 3x de 59.67 sem juros,-,Nao,Nao,Nao,Nintendo,Nintendo Switch
Case Bag Bolsa Estojo De Viagem Proteção Nintendo Switch,R$,57.49,no Pix ,ou 382.80 em 6x de 63.80 sem juros,-,Nao,Nao,Nao,Nintendo,Nintendo Switch
Pelicula De Vidro Temperado 9h Para Tela Nintendo Switch Oled,R$,27.73,no Pix ,ou 169.00 em 3x de 56.33 sem juros,-,Sim,Nao,Nao,Nintendo,Nintendo Switch
Kit 7 in 1 Sportswear Compatível Nintendo Switch e Oled Dobe,R$,190.93,no Pix ,ou 107.89 em 2x de 53.95 sem juros,-,Sim,Nao,Nao,Nintendo,Nintendo Switch
Sonic Forces - Nintendo Switch,R$,171.26,no Pix ,ou 189.00 em 4x de 47.25 sem juros,-,Nao,Nao,Nao,Nintendo,Nintendo Switch
Capa Case Tpu Macio Transparente Proteção Joycon Compativel Nintendo Switch Oled,R$,149.0,no Pix ,ou 233.80 em 5x de 46.76 sem juros,-,Sim,Nao,Nao,Nintendo,Nintendo Switch
Bolsa Capa Case Transporte Proteção Compativel com Nintendo Switch ou Nintendo Switch Oled,R$,249.0,no Pix ,ou 319.99 em 3x de 106.66 sem juros,-,Sim,Nao,Nao,Nintendo,Nintendo Switch
Bolsa Compatível Nintendo Switch Alça com Ombro + Película Vidro Temperado+ 4 Grips,R$,277.44,no Pix ,ou 249.00 em 5x de 49.80 sem juros,-,Nao,Nao,Nao,Nintendo,Nintendo Switch
Capa Compatível Nintendo Switch Pro Controle Case - Super Mario,R$,34.99,no Pix ,ou 297.90 em 6x de 49.65 sem juros,-,Nao,Nao,Nao,Nintendo,Nintendo Switch
Jogo Splatoon 2 Standard Edition Nintendo Switch,R$,287.99,no Pix ,ou 319.99 em 3x de 106.66 sem juros,-,Nao,Nao,Nao,Nintendo,Nintendo Switch
Bolsa Capa Case Transporte Proteção Compativel com Nintendo Switch Lite,R$,249.0,no Pix ,ou 249.00 em 5x de 49.80 sem juros,-,Nao,Sim,Nao,Nintendo,Nintendo Switch
Case Estojo Compatível Nintendo Switch+ Película De Vidro Temperado Oled+ Grips+ Tpu,R$,216.0,no Pix ,ou 225.00 em 5x de 45.00 sem juros,-,Sim,Nao,Nao,Nintendo,Nintendo Switch
Case Mala EVA Rígida De Proteção Para Nintendo Switch,R$,63.25,no Pix ,ou 297.90 em 6x de 49.65 sem juros,-,Nao,Nao,Nao,Nintendo,Nintendo Switch
Dock Station Charger Tetra Power para Carga Simultêna de 4 Joy-Cons Nintendo Switch,R$,297.9,no Pix ,ou 339.99 em 7x de 48.57 sem juros,-,Nao,Nao,Sim,Nintendo,Nintendo Switch
Metroid Dread Nintendo Switch,R$,326.39,no Pix ,ou 299.00 em 6x de 49.83 sem juros,-,Nao,Nao,Nao,Nintendo,Nintendo Switch
Bolsa Capa Case Proteção Joycon Compativel com Nintendo Switch Padrao ou Nintendo Switch Oled,R$,299.0,no Pix ,ou 629.90 em 10x de 62.99 sem juros,-,Sim,Nao,Nao,Nintendo,Nintendo Switch
Bolsa original animal crossing nintendo switch case proteção,R$,611.0,no Pix ,ou 149.00 em 3x de 49.67 sem juros,-,Nao,Nao,Nao,Nintendo,Nintendo Switch
Capa Case Tpu Macio Transparente Proteção Joycon Compativel Nintendo Switch Oled,R$,149.0,no Pix ,ou 349.90 em 7x de 49.99 sem juros,-,Sim,Nao,Nao,Nintendo,Nintendo Switch
Jogo Pokémon Shining Pearl - Nintendo Switch,R$,335.9,no Pix ,ou 131.89 em 2x de 65.95 sem juros,-,Nao,Nao,Nao,Nintendo,Nintendo Switch
Kit Proteção Nintendo Switch 10 em 1 Case Capa Película Grips Vermelho,R$,118.7,no Pix ,ou 120.89 em 2x de 60.45 sem juros,-,Nao,Nao,Nao,Nintendo,Nintendo Switch
Dock Base Estação de Carregamento Para 4 Controle Joy-con de Nintendo Switch Lite Oled - Armazenamento Para 8 Jogos Cinza,R$,108.8,no Pix ,ou 179.00 em 3x de 59.67 sem juros,-,Sim,Sim,Sim,Nintendo,Nintendo Switch
Case Capa Compatível com Nintendo Switch + Película Vidro Oled + 4 Grips Zelda + Par Silicone Joycon,R$,171.84,no Pix ,ou 99.00 em 2x de 49.50 sem juros,-,Sim,Nao,Nao,Nintendo,Nintendo Switch
Case Bag Estojo Rígida Comaptível Nintendo Switch+ Película Vidro+ 4 Grips,R$,95.04,no Pix ,ou 219.89 em 4x de 54.97 sem juros,-,Nao,Nao,Nao,Nintendo,Nintendo Switch
Kit Acessórios Nintendo Switch 17 em 1 - Case Capa Película Grips Fone Cabo Dock Preto,R$,197.9,no Pix ,ou 129.00 em 2x de 64.50 sem juros,-,Nao,Nao,Nao,Nintendo,Nintendo Switch
