titulo,moeda,preco_promo,condition_promo,parcelado,memoria,oled,lite,joy_con,marca,console
Capa Anti Poeira Compatível Nintendo Switch - Modelo 006,R$,44.99,no Pix ,ou 139.00 em 3x de 46.33 sem juros,-,Nao,Nao,Nao,Nintendo,Nintendo Switch
Super Kit 18 em 1 Diversos Acessórios Para Nintendo Switch,R$,335.89,no Pix ,ou 294.80 em 6x de 49.13 sem juros,-,Nao,Nao,Nao,Nintendo,Nintendo Switch
Capa Case Proteção Grip Joycon Tpu Macio Transparente Fosco Compativel com Nintendo Switch Padrao,R$,119.0,no Pix ,ou 374.80 em 6x de 62.47 sem juros,-,Nao,Nao,Nao,Nintendo,Nintendo Switch
Case Capa Estojo + Película Vidro + 4 Grip Compatível com Nintendo Switch,R$,104.64,no Pix ,ou 300.80 em 6x de 50.13 sem juros,-,Nao,Nao,Nao,Nintendo,Nintendo Switch
Ninja Gaiden: Master Collection - Switch,R$,320.22,no Pix ,ou 458.99 em 10x de 45.90 sem juros,-,Nao,Nao,Nao,Nintendo,Nintendo Switch
Mario Party Superstars - Switch,R$,337.32,no Pix ,ou 374.80 em 6x de 62.47 sem juros,-,Nao,Nao,Nao,Nintendo,Nintendo Switch
Capa Case e Skin Adesivo Compatível Nintendo Switch Pro Controle - Chrono Trigger,R$,54.99,no Pix ,ou 239.00 em 5x de 47.80 sem juros,-,Nao,Nao,Nao,Nintendo,Nintendo Switch
Bolsa Capa Case Proteção Transporte Grip Joycon Compativel com Nintendo Switch Lite,R$,239.0,no Pix ,ou 219.00 em 4x de 54.75 sem juros,-,Nao,Sim,Nao,Nintendo,Nintendo Switch
Case Capa Proteção Tpu Grip Ergonômico Joycon Compativel com Nintendo Switch Oled!,R$,219.0,no Pix ,ou 159.00 em 3x de 53.00 sem juros,-,Sim,Nao,Nao,Nintendo,Nintendo Switch
Capa Case Acrílico Transparente Proteção Grips Compativel com Nintendo Switch Lite,R$,159.0,no Pix ,ou 149.00 em 3x de 49.67 sem juros,-,Nao,Sim,Nao,Nintendo,Nintendo Switch
Capa Case Proteção Joycon Tpu Macio Compatível com Nintendo Switch,R$,149.0,no Pix ,ou 179.00 em 3x de 59.67 sem juros,-,Nao,Nao,Nao,Nintendo,Nintendo Switch
Case Compatível Nintendo Switch Bolsa Estojo - Doom,R$,39.99,no Pix ,ou 229.00 em 5x de 45.80 sem juros,-,Nao,Nao,Nao,Nintendo,Nintendo Switch
Cabo Flat Sr E Sl Botão Joy-con Nintendo Switch + Chaves Y X,R$,25.1,no Pix ,ou 189.00 em 4x de 47.25 sem juros,-,Nao,Nao,Sim,Nintendo,Nintendo Switch
Kit Case Compatível com Nintendo Switch Oled Pelicula Grip Silicone Joy Con,R$,171.84,no Pix ,ou 179.00 em 3x de 59.67 sem juros,-,Sim,Nao,Nao,Nintendo,Nintendo Switch
Capa Case Silicone Tpu Para Nintendo Switch Oled Proteção,R$,71.09,no Pix ,ou 265.80 em 5x de 53.16 sem juros,-,Sim,Nao,Nao,Nintendo,Nintendo Switch
Sonic Mania + Team Sonic Racing Double Pack Nintendo Switch Lacrado,R$,206.1,no Pix ,ou 394.80 em 6x de 65.80 sem juros,-,Nao,Nao,Nao,Nintendo,Nintendo Switch
Case Compatível Nintendo Switch Lite Bolsa Estojo - Monster Hunter Rise,R$,39.99,no Pix ,ou 286.80 em 2x de 143.40 sem juros,-,Nao,Sim,Nao,Nintendo,Nintendo Switch
Capa Substituição Botão Analógico 3d Controle Joycon Compativel com Nintendo Switch,R$,35.0,no Pix ,ou 349.90 em 7x de 49.99 sem juros,-,Nao,Nao,Nao,Nintendo,Nintendo Switch
Case Compatível Nintendo Switch Bolsa Estojo - Zelda Breath Of The Wild,R$,39.99,no Pix ,ou 142.89 em 3x de 47.63 sem juros,-,Nao,Nao,Nao,Nintendo,Nintendo Switch
Adesivo Compatível Nintendo Switch Oled Skin - Zelda Tears of the Kingdom Edition,R$,49.99,no Pix ,ou 394.90 em 8x de 49.36 sem juros,-,Sim,Nao,Nao,Nintendo,Nintendo Switch
Capa Anti Poeira e Skin Compatível Nintendo Switch Oled - Tetris 99,R$,79.0,no Pix ,ou 179.00 em 3x de 59.67 sem juros,-,Sim,Nao,Nao,Nintendo,Nintendo Switch
Charging Dock Acrílico Carregador Joy Controle Nintendo Switch,R$,70.55,no Pix ,ou 329.90 em 7x de 47.13 sem juros,-,Nao,Nao,Nao,Nintendo,Nintendo Switch
Case Compatível Nintendo Switch Lite Bolsa Estojo - Super Mario Odyssey,R$,39.99,no Pix ,ou 219.90 em 4x de 54.98 sem juros,-,Nao,Sim,Nao,Nintendo,Nintendo Switch
"Grip Suporte De Mão Para Nintendo Switch, Lite, Oled e Controles Joy Con",R$,64.25,no Pix ,ou 374.80 em 6x de 62.47 sem juros,-,Sim,Sim,Nao,Nintendo,Nintendo Switch
Bolsa Case Transporte Nintendo Switch Morango Rosa Menina,R$,189.0,no Pix ,ou 300.80 em 6x de 50.13 sem juros,-,Nao,Nao,Nao,Nintendo,Nintendo Switch
Capa Case Estojo Nintendo Switch Console Vermelha + Pelicula,R$,75.73,no Pix ,ou 366.80 em 6x de 61.13 sem juros,-,Nao,Nao,Nao,Nintendo,Nintendo Switch
Bag Bolsa Estojo Viagem Nintendo Switch Vermelha + Pelicula,R$,75.73,no Pix ,ou 374.80 em 6x de 62.47 sem juros,-,Nao,Nao,Nao,Nintendo,Nintendo Switch
Capa Anti Poeira Compatível Nintendo Switch - Luigi's Mansion 3,R$,44.99,no Pix ,ou 142.89 em 3x de 47.63 sem juros,-,Nao,Nao,Nao,Nintendo,Nintendo Switch
Película Para Console Nintendo Switch Oled Tela 9h Vidro,R$,22.49,no Pix ,ou 139.00 em 3x de 46.33 sem juros,-,Sim,Nao,Nao,Nintendo,Nintendo Switch
Kit Case Compatível com Nintendo Switch Oled Pelicula Grip Silicone Joy Con,R$,171.84,no Pix ,ou 208.89 em 4x de 52.22 sem juros,-,Sim,Nao,Nao,Nintendo,Nintendo Switch
Monster Hunter Rise - Switch,R$,239.22,no Pix ,ou 379.90 em 8x de 47.49 sem juros,-,Nao,Nao,Nao,Nintendo,Nintendo Switch
Pokémon Scarlet - Switch,R$,355.32,no Pix ,ou 267.90 em 5x de 53.58 sem juros,-,Nao,Nao,Nao,Nintendo,Nintendo Switch
Klonoa Phantasy Reverie Series - Switch,R$,258.12,no Pix ,ou 249.00 em 5x de 49.80 sem juros,-,Nao,Nao,Nao,Nintendo,Nintendo Switch
Donkey Kong Country: Tropical Freeze - Nintendo Switch,R$,335.9,no Pix ,ou 349.90 em 6x de 58.32 sem juros,-,Nao,Nao,Nao,Nintendo,Nintendo Switch
Case Bolsa Estojo De Viagem Capa De Proteção Nintendo Switch,R$,128.6,no Pix ,ou 225.00 em 5x de 45.00 sem juros,-,Nao,Nao,Nao,Nintendo,Nintendo Switch
Case Compatível Nintendo Switch Lite Bolsa Estojo - Modelo 060,R$,39.99,no Pix ,ou 225.00 em 5x de 45.00 sem juros,-,Nao,Sim,Nao,Nintendo,Nintendo Switch
Case Estojo Compatível Nintendo Switch+ Película De Vidro Temperado Oled+ Grips+ Tpu,R$,216.0,no Pix ,ou 319.80 em 6x de 53.30 sem juros,-,Sim,Nao,Nao,Nintendo,Nintendo Switch
Dark Souls Remastered - Switch,R$,287.82,no Pix ,ou 349.90 em 6x de 58.32 sem juros,-,Nao,Nao,Nao,Nintendo,Nintendo Switch
Mario Rabbids Sparks Of Hope - Nintendo Switch,R$,332.41,no Pix ,ou 179.00 em 3x de 59.67 sem juros,-,Nao,Nao,Nao,Nintendo,Nintendo Switch
Suporte para Suporte Nintendo Switch Joy-Con,R$,34.18,no Pix ,ou 398.75 em 8x de 49.84 sem juros,-,Nao,Nao,Sim,Nintendo,Nintendo Switch
Case Capa Compatível com Nintendo Switch + Película Vidro Oled + 4 Grips Zelda + Par Silicone Joycon,R$,171.84,no Pix ,ou 249.00 em 5x de 49.80 sem juros,-,Sim,Nao,Nao,Nintendo,Nintendo Switch
Jogo The Legend of Zelda: Tears of The Kingdom Nintendo Switch Mídia Física,R$,370.84,no Pix ,ou 342.90 em 7x de 48.99 sem juros,-,Nao,Nao,Nao,Nintendo,Nintendo Switch
Dock Portátil Para Nintendo Switch Transmite Imagem Tv Hdmi,R$,182.3,no Pix ,ou 149.00 em 3x de 49.67 sem juros,-,Nao,Nao,Nao,Nintendo,Nintendo Switch
Kit 2 Analógico 3d Botão Direcional Joy-con Compatível com Nintendo Switch,R$,47.5,no Pix ,ou 416.80 em 6x de 69.47 sem juros,-,Nao,Nao,Sim,Nintendo,Nintendo Switch
Bolsa Capa Case Transporte Proteção Cinza Compativel com Nintendo Switch Ou Nintendo Switch Oled,R$,249.0,no Pix ,ou 179.00 em 3x de 59.67 sem juros,-,Sim,Nao,Nao,Nintendo,Nintendo Switch
Capa Anti Poeira e Skin Compatível Nintendo Switch - Zelda Tears of the Kingdom Edition,R$,79.0,no Pix ,ou 294.80 em 6x de 49.13 sem juros,-,Nao,Nao,Nao,Nintendo,Nintendo Switch
Capa Compatível Nintendo Switch Pro Controle Case - Doom,R$,34.99,no Pix ,ou 219.00 em 4x de 54.75 sem juros,-,Nao,Nao,Nao,Nintendo,Nintendo Switch
Capa Case e Skin Adesivo Compatível Nintendo Switch Pro Controle - Pikmin,R$,54.99,no Pix ,ou 153.89 em 3x de 51.30 sem juros,-,Nao,Nao,Nao,Nintendo,Nintendo Switch
Jogo Metroid Prime Remastered - Nintendo Switch,R$,329.18,no Pix ,ou 245.80 em 5x de 49.16 sem juros,-,Nao,Nao,Nao,Nintendo,Nintendo Switch
2 Pulseiras Faixa Strap Alça Pulso Dance Para Joycon Compativel com Nintendo Switch ou Oled,R$,149.0,no Pix ,ou 249.00 em 5x de 49.80 sem juros,-,Sim,Nao,Nao,Nintendo,Nintendo Switch
Case Compatível Nintendo Switch Lite Bolsa Estojo - The Punisher Justiceiro,R$,39.99,no Pix ,ou 249.00 em 5x de 49.80 sem juros,-,Nao,Sim,Nao,Nintendo,Nintendo Switch
Case Compatível Nintendo Switch Bolsa Estojo - Zelda: Majoras Mask,R$,39.99,no Pix ,ou 254.80 em 5x de 50.96 sem juros,-,Nao,Nao,Nao,Nintendo,Nintendo Switch
Capa Anti Poeira e Skin Compatível Nintendo Switch Oled - Animal Crossing,R$,79.0,no Pix ,ou 149.00 em 3x de 49.67 sem juros,-,Sim,Nao,Nao,Nintendo,Nintendo Switch
Case Compatível Com Nintendo Switch Estojo Proteção Viagem + 2 películas,R$,85.44,no Pix ,ou 149.00 em 3x de 49.67 sem juros,-,Nao,Nao,Nao,Nintendo,Nintendo Switch
Adesivo Compatível Nintendo Switch Lite Skin - Zelda Tears of the Kingdom,R$,44.99,no Pix ,ou 199.90 em 4x de 49.98 sem juros,-,Nao,Sim,Nao,Nintendo,Nintendo Switch
Master Detective Archives: RAIN CODE - Switch,R$,375.12,no Pix ,ou 116.49 em 2x de 58.25 sem juros,-,Nao,Nao,Nao,Nintendo,Nintendo Switch
Case Compatível Nintendo Switch Bolsa Estojo - Nintendinho Nes,R$,39.99,no Pix ,ou 711.80 em 6x de 118.63 sem juros,-,Nao,Nao,Nao,Nintendo,Nintendo Switch
Kit Case Compatível com Nintendo Switch Oled Pelicula Grip Silicone Joy Con,R$,171.84,no Pix ,ou 95.00 em 2x de 47.50 sem juros,-,Sim,Nao,Nao,Nintendo,Nintendo Switch
Mario & Sonic at the Olympic Games: Tokyo 2020 - SWITCH,R$,265.32,no Pix ,ou 299.90 em 6x de 49.98 sem juros,-,Nao,Nao,Nao,Nintendo,Nintendo Switch
Case Capa Proteção Tpu Grip Ergonômico Joycon Compativel com Nintendo Switch Oled!,R$,219.0,no Pix ,ou 259.00 em 5x de 51.80 sem juros,-,Sim,Nao,Nao,Nintendo,Nintendo Switch
Case Compatível Nintendo Switch Bolsa Estojo - Super Mario,R$,39.99,no Pix ,ou 569.90 em 10x de 56.99 sem juros,-,Nao,Nao,Nao,Nintendo,Nintendo Switch
Controle Usb Compatível Com Nintendo Switch Computador Notebook Turbo,R$,138.5,no Pix ,ou 239.99 em 5x de 48.00 sem juros,-,Nao,Nao,Nao,Nintendo,Nintendo Switch
Case Compatível Nintendo Switch Bolsa Estojo - Modelo 050,R$,39.99,no Pix ,ou 131.89 em 2x de 65.95 sem juros,-,Nao,Nao,Nao,Nintendo,Nintendo Switch
Película De Hidrogel Compatível Para Nintendo Switch Vários Modelos,R$,22.5,no Pix ,ou 235.10 em 5x de 47.02 sem juros,-,Nao,Nao,Nao,Nintendo,Nintendo Switch
Kit Proteção Nintendo Switch Lite 10 em 1 Case Capa Película,R$,118.7,no Pix ,ou 357.80 em 6x de 59.63 sem juros,-,Nao,Sim,Nao,Nintendo,Nintendo Switch
Capa Case Estojo Para Nintendo Switch Console + Pelicula Vdr,R$,75.73,no Pix ,ou 249.00 em 5x de 49.80 sem juros,-,Nao,Nao,Nao,Nintendo,Nintendo Switch
Carregador Duplo Pokebola Plus Nintendo Switch Base PokeBall,R$,44.45,no Pix ,ou 131.89 em 2x de 65.95 sem juros,-,Nao,Nao,Nao,Nintendo,Nintendo Switch
Case Bag Bolsa Estojo De Viagem Proteção Nintendo Switch,R$,57.49,no Pix ,ou 211.99 em 4x de 53.00 sem juros,-,Nao,Nao,Nao,Nintendo,Nintendo Switch
Shovel Knight: Treasure Trove - Nintendo Switch,R$,225.7,no Pix ,ou 159.89 em 3x de 53.30 sem juros,-,Nao,Nao,Nao,Nintendo,Nintendo Switch
Dead Cells: Return to Castlevania Edition - Switch,R$,322.02,no Pix ,ou 169.00 em 3x de 56.33 sem juros,-,Nao,Nao,Nao,Nintendo,Nintendo Switch
Bolsa Capa Case Transporte + Pelicula + Grips Anime Compativel com Nintendo Switch e Switch Oled,R$,249.0,no Pix ,ou 105.00 em 2x de 52.50 sem juros,-,Sim,Nao,Nao,Nintendo,Nintendo Switch
Kit Proteção Nintendo Switch 10 em 1 Case Capa Película Grips Azul,R$,118.7,no Pix ,ou 219.00 em 4x de 54.75 sem juros,-,Nao,Nao,Nao,Nintendo,Nintendo Switch
Case Transporte para Nintendo Switch com Split Pad Proteção,R$,211.99,no Pix ,ou 208.80 em 4x de 52.20 sem juros,-,Nao,Nao,Nao,Nintendo,Nintendo Switch
Kit 2 Volante Wheel Para Joy-Con de Nintendo Switch e Oled,R$,151.9,no Pix ,ou 179.00 em 3x de 59.67 sem juros,-,Sim,Nao,Sim,Nintendo,Nintendo Switch
Case De Jogos Premium Para Gamecard Compativel com Nintendo Switch Joycon Tema GameBoy,R$,169.0,no Pix ,ou 238.80 em 5x de 47.76 sem juros,-,Nao,Nao,Nao,Nintendo,Nintendo Switch
Porta Jogos Para Nintendo Switch - Tema Pokebola - Pokemon,R$,105.0,no Pix ,ou 461.80 em 6x de 76.97 sem juros,-,Nao,Nao,Nao,Nintendo,Nintendo Switch
Controle Compativel com Nintendo Switch sem fio,R$,210.24,no Pix ,ou 349.90 em 7x de 49.99 sem juros,-,Nao,Nao,Nao,Nintendo,Nintendo Switch
Capa Anti Poeira Compatível Nintendo Switch - Bomberman,R$,44.99,no Pix ,ou 463.88 em 5x de 92.78 sem juros,-,Nao,Nao,Nao,Nintendo,Nintendo Switch
Disney Classic Games: Aladdin and The Lion King - Switch,R$,187.92,no Pix ,ou 488.80 em 6x de 81.47 sem juros,-,Nao,Nao,Nao,Nintendo,Nintendo Switch
Kit Case Compatível com Nintendo Switch Oled Pelicula Grip Silicone Joy Con,R$,171.84,no Pix ,ou 249.00 em 5x de 49.80 sem juros,-,Sim,Nao,Nao,Nintendo,Nintendo Switch
Dragon Ball: The Breakers Special Edition - SWITCH,R$,214.92,no Pix ,ou 149.00 em 3x de 49.67 sem juros,-,Nao,Nao,Nao,Nintendo,Nintendo Switch
The Legend of Zelda: Tears of the Kingdom - Switch,R$,415.62,no Pix ,ou 259.00 em 5x de 51.80 sem juros,-,Nao,Nao,Nao,Nintendo,Nintendo Switch
Animal Crossing: New Horizons Nintendo Switch,R$,332.41,no Pix ,ou 149.00 em 3x de 49.67 sem juros,-,Nao,Nao,Nao,Nintendo,Nintendo Switch
Controle Nintendo Switch Pro Controller - HACAFSSK2,R$,463.88,no Pix ,ou 149.00 em 3x de 49.67 sem juros,-,Nao,Nao,Nao,Nintendo,Nintendo Switch
Case Compatível Nintendo Switch Bolsa Estojo - Modelo 057,R$,39.99,no Pix ,ou 149.00 em 3x de 49.67 sem juros,-,Nao,Nao,Nao,Nintendo,Nintendo Switch
Cooler Para Nintendo Switch - Lite - Oled Exautor De Calor Refrigeração Fan,R$,98.9,no Pix ,ou 179.00 em 3x de 59.67 sem juros,-,Sim,Sim,Nao,Nintendo,Nintendo Switch
Fatal Frame: Mask of the Lunar Eclipse - Switch,R$,439.92,no Pix ,ou 179.00 em 3x de 59.67 sem juros,-,Nao,Nao,Nao,Nintendo,Nintendo Switch
Capa Anti Poeira e Skin Compatível Nintendo Switch Oled - Radioativo,R$,79.0,no Pix ,ou 239.00 em 5x de 47.80 sem juros,-,Sim,Nao,Nao,Nintendo,Nintendo Switch
Capa Case Proteção Estojo Porta 24 Jogos Cartucho Gamecard Joycon Compativel com Nintendo Switch,R$,249.0,no Pix ,ou 199.90 em 4x de 49.98 sem juros,-,Nao,Nao,Nao,Nintendo,Nintendo Switch
Case Compatível Nintendo Switch Lite Bolsa Estojo - Zelda Tears of the Kingdom Edition,R$,39.99,no Pix ,ou 179.90 em 3x de 59.97 sem juros,-,Nao,Sim,Nao,Nintendo,Nintendo Switch
Capa Case Proteção Tpu Macio Joycon Grip Compativel com Nintendo Switch,R$,149.0,no Pix ,ou 159.00 em 3x de 53.00 sem juros,-,Nao,Nao,Nao,Nintendo,Nintendo Switch
Bolsa Case Transporte Pelicula Grips Proteção Compativel com Nintendo Switch Oled,R$,259.0,no Pix ,ou 366.80 em 6x de 61.13 sem juros,-,Sim,Nao,Nao,Nintendo,Nintendo Switch
Case Capa Proteção Tpu Macio Premium Joycon Compativel com Nintendo Switch Lite,R$,149.0,no Pix ,ou 99.00 em 2x de 49.50 sem juros,-,Nao,Sim,Nao,Nintendo,Nintendo Switch
Capa Case Protecao Acrilico dos Botões Preto Joycon Compativel com Nintendo Switch Padrao,R$,149.0,no Pix ,ou 249.90 em 5x de 49.98 sem juros,-,Nao,Nao,Nao,Nintendo,Nintendo Switch
Capa Case Proteção Premium Protecao Acrilico dos Botões Joycon Compativel com Nintendo Switch Padrao,R$,149.0,no Pix ,ou 219.90 em 4x de 54.98 sem juros,-,Nao,Nao,Nao,Nintendo,Nintendo Switch
Case Capa Compatível com Nintendo Switch + Película Vidro Oled + 4 Grips Zelda + Par Silicone Joycon,R$,171.84,no Pix ,ou 429.99 em 9x de 47.78 sem juros,-,Sim,Nao,Nao,Nintendo,Nintendo Switch
Capa Case Shell Tpu Grip Ergonômico + Case De Jogos Transparente Compativel com Nintendo Switch,R$,179.0,no Pix ,ou 349.80 em 6x de 58.30 sem juros,-,Nao,Nao,Nao,Nintendo,Nintendo Switch
Capa Compatível Nintendo Switch Pro Controle Case - Super Mario Bros. Wonder,R$,34.99,no Pix ,ou 898.89 em 10x de 89.89 sem juros,-,Nao,Nao,Nao,Nintendo,Nintendo Switch
Bolsa Película Compativel com Nintendo Switch Lite Case Capa Animal Crossing!!,R$,239.0,no Pix ,ou 189.00 em 4x de 47.25 sem juros,-,Nao,Sim,Nao,Nintendo,Nintendo Switch
Record of Agarest War - Switch,R$,268.92,no Pix ,ou 298.80 em 6x de 49.80 sem juros,-,Nao,Nao,Nao,Nintendo,Nintendo Switch
Capa Case Proteção Tpu Macio Joycon Grip Compativel com Nintendo Switch,R$,149.0,no Pix ,ou 149.00 em 3x de 49.67 sem juros,-,Nao,Nao,Nao,Nintendo,Nintendo Switch
Case Compatível Nintendo Switch Lite Bolsa Estojo - Batman Comics,R$,39.99,no Pix ,ou 109.00 em 2x de 54.50 sem juros,-,Nao,Sim,Nao,Nintendo,Nintendo Switch
"Grips Capa Proteção Analógico Joycon Compativel com Nintendo Switch, Switch Lite ou Switch Oled",R$,49.0,no Pix ,ou 189.00 em 4x de 47.25 sem juros,-,Sim,Sim,Nao,Nintendo,Nintendo Switch
Capa Case Proteção Acrilico Cristal Transparente Compativel com Nintendo Switch Lite,R$,109.0,no Pix ,ou 249.00 em 5x de 49.80 sem juros,-,Nao,Sim,Nao,Nintendo,Nintendo Switch
Bag Bolsa Estojo Viagem Nintendo Switch Preto + Pelicula,R$,75.73,no Pix ,ou 149.90 em 3x de 49.97 sem juros,-,Nao,Nao,Nao,Nintendo,Nintendo Switch
Capa Case Proteção Silicone Macio Joycon Grip Compativel com Nintendo Switch Oled,R$,189.0,no Pix ,ou 189.00 em 4x de 47.25 sem juros,-,Sim,Nao,Nao,Nintendo,Nintendo Switch
Bolsa Transporte Capa Case Animal Crossing Compativel com Nintendo Switch Lite,R$,249.0,no Pix ,ou 139.00 em 3x de 46.33 sem juros,-,Nao,Sim,Nao,Nintendo,Nintendo Switch
Case Capa Proteção Tpu Grip Ergonômico Compativel com Nintendo Switch Lite,R$,149.9,no Pix ,ou 799.00 em 10x de 79.90 sem juros,-,Nao,Sim,Nao,Nintendo,Nintendo Switch
Case Capa Shell Tpu Grip Ergonômico Joycon Compativel com Nintendo Switch Oled,R$,189.0,no Pix ,ou 233.80 em 5x de 46.76 sem juros,-,Sim,Nao,Nao,Nintendo,Nintendo Switch
Case Compatível Nintendo Switch Lite Bolsa Estojo - Dead Cells,R$,39.99,no Pix ,ou 239.00 em 5x de 47.80 sem juros,-,Nao,Sim,Nao,Nintendo,Nintendo Switch
2 Pulseiras Faixa Strap Alça Pulso Dance Joycon Compativel com Nintendo Switch,R$,139.0,no Pix ,ou 439.70 em 6x de 73.28 sem juros,-,Nao,Nao,Nao,Nintendo,Nintendo Switch
Case Compatível Nintendo Switch Lite Bolsa Estojo - Madeira,R$,39.99,no Pix ,ou 257.80 em 5x de 51.56 sem juros,-,Nao,Sim,Nao,Nintendo,Nintendo Switch
Capa Anti Poeira Compatível Nintendo Switch - Super Mario,R$,44.99,no Pix ,ou 299.00 em 6x de 49.83 sem juros,-,Nao,Nao,Nao,Nintendo,Nintendo Switch
Case Compatível Nintendo Switch Bolsa Estojo - New Super Mario Bros. U,R$,39.99,no Pix ,ou 139.00 em 3x de 46.33 sem juros,-,Nao,Nao,Nao,Nintendo,Nintendo Switch
Capa Substituição Botão Analógico 3d Controle Joycon Compativel com Nintendo Switch,R$,35.0,no Pix ,ou 239.00 em 5x de 47.80 sem juros,-,Nao,Nao,Nao,Nintendo,Nintendo Switch
Bolsa Capa Transporte Proteção Grip Joycon Compativel com Nintendo Switch Padrao ou Switch Oled,R$,799.0,no Pix ,ou 152.35 em 3x de 50.78 sem juros,-,Sim,Nao,Nao,Nintendo,Nintendo Switch
Capa Compatível Nintendo Switch Pro Controle Case - Zelda Tears of the Kingdom Edition,R$,34.99,no Pix ,ou 384.80 em 4x de 96.20 sem juros,-,Nao,Nao,Nao,Nintendo,Nintendo Switch
Tennis World Tour 2 - Switch,R$,210.42,no Pix ,ou 131.89 em 2x de 65.95 sem juros,-,Nao,Nao,Nao,Nintendo,Nintendo Switch
Bolsa Capa Case Proteção Transporte Grip Joycon Compativel com Nintendo Switch Lite,R$,239.0,no Pix ,ou 329.90 em 2x de 164.95 sem juros,-,Nao,Sim,Nao,Nintendo,Nintendo Switch
Metal Gear Solid: Master Collection Vol. 1 Nintendo Switch,R$,439.7,no Pix ,ou 374.80 em 6x de 62.47 sem juros,-,Nao,Nao,Nao,Nintendo,Nintendo Switch
Capa Compatível Nintendo Switch Pro Controle Case - Kingdom Hearts 3,R$,34.99,no Pix ,ou 280.00 em 6x de 46.67 sem juros,-,Nao,Nao,Nao,Nintendo,Nintendo Switch
Teenage Mutant Ninja Turtles: The Turtles Cowabunga Collection - SWITCH,R$,232.02,no Pix ,ou 179.90 em 3x de 59.97 sem juros,-,Nao,Nao,Nao,Nintendo,Nintendo Switch
Kit Capa de Proteção + Película Vidro para Nintendo Switch,R$,74.96,no Pix ,ou 119.00 em 2x de 59.50 sem juros,-,Nao,Nao,Nao,Nintendo,Nintendo Switch
Capa Case Proteção Tpu Macio Joycon Grip Compatível com Nintendo Switch Oled,R$,299.0,no Pix ,ou 216.80 em 4x de 54.20 sem juros,-,Sim,Nao,Nao,Nintendo,Nintendo Switch
Capa Case Proteção Tpu Macio Joycon Grip Compativel com Nintendo Switch Lite,R$,139.0,no Pix ,ou 190.80 em 4x de 47.70 sem juros,-,Nao,Sim,Nao,Nintendo,Nintendo Switch
Capa Case Proteção Tpu Grip Ergonômico + Pelicula Compativel com Nintendo Switch Padrao,R$,239.0,no Pix ,ou 325.80 em 6x de 54.30 sem juros,-,Nao,Nao,Nao,Nintendo,Nintendo Switch
Controle Joystich Sem Fio Nintendo Switch Pc Ps3 Android - FEIR,R$,137.12,no Pix ,ou 149.00 em 3x de 49.67 sem juros,-,Nao,Nao,Nao,Nintendo,Nintendo Switch
"Jogo Switch Zelda: Breath of the Wild , NINTENDO NINTENDO",R$,384.8,no Pix ,ou 269.00 em 5x de 53.80 sem juros,-,Nao,Nao,Nao,Nintendo,Nintendo Switch
Controle line kitten nintendo switch preto pc gamer,R$,533.4,no Pix ,ou 549.90 em 10x de 54.99 sem juros,-,Nao,Nao,Nao,Nintendo,Nintendo Switch
Case Capa Proteção Tpu Grip Ergonômico Compativel com Nintendo Switch Lite,R$,149.9,no Pix ,ou 149.90 em 3x de 49.97 sem juros,-,Nao,Sim,Nao,Nintendo,Nintendo Switch
Capa Anti Poeira Compatível Nintendo Switch - Sonic Mania,R$,44.99,no Pix ,ou 149.00 em 3x de 49.67 sem juros,-,Nao,Nao,Nao,Nintendo,Nintendo Switch
Case Compatível Nintendo Switch Bolsa Estojo - Modelo 016,R$,39.99,no Pix ,ou 406.90 em 9x de 45.21 sem juros,-,Nao,Nao,Nao,Nintendo,Nintendo Switch
Case Compatível Nintendo Switch Bolsa Estojo - Modelo 013,R$,39.99,no Pix ,ou 179.00 em 3x de 59.67 sem juros,-,Nao,Nao,Nao,Nintendo,Nintendo Switch
Headset Dreamgear X-Talk Gaming Compatível Nintendo Switch,R$,143.04,no Pix ,ou 369.00 em 8x de 46.13 sem juros,-,Nao,Nao,Nao,Nintendo,Nintendo Switch
Case Compatível Nintendo Switch Bolsa Estojo - Final Fantasy Vii: Remake,R$,39.99,no Pix ,ou 149.00 em 3x de 49.67 sem juros,-,Nao,Nao,Nao,Nintendo,Nintendo Switch
Capa Anti Poeira Compatível Nintendo Switch - Modelo 064,R$,44.99,no Pix ,ou 249.00 em 5x de 49.80 sem juros,-,Nao,Nao,Nao,Nintendo,Nintendo Switch
Capa Compatível Nintendo Switch Pro Controle Case - Modelo 006,R$,34.99,no Pix ,ou 149.00 em 3x de 49.67 sem juros,-,Nao,Nao,Nao,Nintendo,Nintendo Switch
Adesivo Compatível Nintendo Switch Lite Skin - Radioativo,R$,44.99,no Pix ,ou 729.00 em 10x de 72.90 sem juros,-,Nao,Sim,Nao,Nintendo,Nintendo Switch
Capa Case De Acrilico Para Nintendo Switch V1 V2,R$,62.99,no Pix ,ou 374.80 em 6x de 62.47 sem juros,-,Nao,Nao,Nao,Nintendo,Nintendo Switch
Película De Proteção P/ Nintendo Switch - Vidro Resistente,R$,28.79,no Pix ,ou 225.00 em 5x de 45.00 sem juros,-,Nao,Nao,Nao,Nintendo,Nintendo Switch
Super Mario 3D World + Bowser's Fury - Nintendo Switch,R$,390.62,no Pix ,ou 376.80 em 6x de 62.80 sem juros,-,Nao,Nao,Nao,Nintendo,Nintendo Switch
Case Capa Compatível com Nintendo Switch + Película Vidro Oled + 4 Grips Zelda + Par Silicone Joycon,R$,171.84,no Pix ,ou 2199.00 em 10x de 219.90 sem juros,-,Sim,Nao,Nao,Nintendo,Nintendo Switch
Cabo Flat Sr E Sl Botão Joy-con Nintendo Switch + Chaves Y X,R$,25.34,no Pix ,ou 366.80 em 6x de 61.13 sem juros,-,Nao,Nao,Sim,Nintendo,Nintendo Switch
Capa Compatível Nintendo Switch Pro Controle Case - Mario Kart 8,R$,34.99,no Pix ,ou 116.49 em 2x de 58.25 sem juros,-,Nao,Nao,Nao,Nintendo,Nintendo Switch
Capa Case Bolsa Transporte Proteção Mumba Preto Para Nintendo Switch Padrao ou Oled,R$,369.0,no Pix ,ou 376.80 em 6x de 62.80 sem juros,-,Sim,Nao,Nao,Nintendo,Nintendo Switch
Capa Case Proteção Acrilico Premium Branco Joycon Grip Compativel com Nintendo Switch Padrao,R$,149.0,no Pix ,ou 107.89 em 2x de 53.95 sem juros,-,Nao,Nao,Nao,Nintendo,Nintendo Switch
Case Capa Bolsa Transporte Grip Joycon Compativel com Nintendo Switch Ou Nintendo Switch Oled,R$,249.0,no Pix ,ou 329.80 em 6x de 54.97 sem juros,-,Sim,Nao,Nao,Nintendo,Nintendo Switch
Case Bolsa Bag Estojo Nintendo Switch Preto Azul Vermelho,R$,57.6,no Pix ,ou 183.80 em 4x de 45.95 sem juros,-,Nao,Nao,Nao,Nintendo,Nintendo Switch
Pulseiras Faixa Strap Alça Perna Esportes Compativel com Nintendo Switch ou Oled Joycon,R$,149.0,no Pix ,ou 149.00 em 3x de 49.67 sem juros,-,Sim,Nao,Nao,Nintendo,Nintendo Switch
Straps para Pulso e Pernas do Nintendo Switch/Oled,R$,75.73,no Pix ,ou 159.00 em 3x de 53.00 sem juros,-,Sim,Nao,Nao,Nintendo,Nintendo Switch
Case Compatível Nintendo Switch Bolsa Estojo - Modelo 025,R$,39.99,no Pix ,ou 189.00 em 4x de 47.25 sem juros,-,Nao,Nao,Nao,Nintendo,Nintendo Switch
Bolsa Case Nintendo Switch Oled Rígida Transporte Maleta Luxo,R$,699.84,no Pix ,ou 324.90 em 7x de 46.41 sem juros,-,Sim,Nao,Nao,Nintendo,Nintendo Switch
Bayonetta 3 - SWITCH,R$,337.32,no Pix ,ou 179.00 em 3x de 59.67 sem juros,-,Nao,Nao,Nao,Nintendo,Nintendo Switch
Case Estojo Compatível Nintendo Switch+ Película De Vidro Temperado Oled+ Grips+ Tpu,R$,216.0,no Pix ,ou 325.49 em 7x de 46.50 sem juros,-,Sim,Nao,Nao,Nintendo,Nintendo Switch
Película 3d Para Tela Console Nintendo Switch De Vidro 9h,R$,21.5,no Pix ,ou 270.58 em 6x de 45.10 sem juros,-,Nao,Nao,Nao,Nintendo,Nintendo Switch
Capa Substituição Botão Analógico 3d Controle Joycon Compativel com Nintendo Switch,R$,35.0,no Pix ,ou 525.80 em 6x de 87.63 sem juros,-,Nao,Nao,Nao,Nintendo,Nintendo Switch
Case Compatível Nintendo Switch Bolsa Estojo - Modelo 004,R$,39.99,no Pix ,ou 370.80 em 6x de 61.80 sem juros,-,Nao,Nao,Nao,Nintendo,Nintendo Switch
New Super Mario Bros U Deluxe Novo - Switch,R$,339.12,no Pix ,ou 369.00 em 8x de 46.13 sem juros,-,Nao,Nao,Nao,Nintendo,Nintendo Switch
Case Compatível Nintendo Switch Lite Bolsa Estojo - Zelda Ocarina Of Time,R$,39.99,no Pix ,ou 378.80 em 6x de 63.13 sem juros,-,Nao,Sim,Nao,Nintendo,Nintendo Switch
Fire Emblem Engage - SWITCH,R$,340.92,no Pix ,ou 269.80 em 5x de 53.96 sem juros,-,Nao,Nao,Nao,Nintendo,Nintendo Switch
Resident Evil Origins Collection - Switch,R$,242.82,no Pix ,ou 220.80 em 4x de 55.20 sem juros,-,Nao,Nao,Nao,Nintendo,Nintendo Switch
Gang Beasts - Switch,R$,198.72,no Pix ,ou 325.49 em 7x de 46.50 sem juros,-,Nao,Nao,Nao,Nintendo,Nintendo Switch
