titulo,moeda,preco_promo,condition_promo,parcelado,memoria,oled,lite,joy_con,marca,console
Controle Joystick Sem Fio Compativel c/ Nintendo Switch Joy-Con (L+R),R$,312.47,no Pix ,ou 499.89 em 10x de 49.99 sem juros,-,Nao,Nao,Sim,Nintendo,Nintendo Switch
Jogo The Legend of Zelda: Tears of The Kingdom - Switch,R$,479.89,no Pix ,ou 358.80 em 6x de 59.80 sem juros,-,Nao,Nao,Nao,Nintendo,Nintendo Switch
Miitopia - Switch,R$,322.92,no Pix ,ou 549.00 em 10x de 54.90 sem juros,-,Nao,Nao,Nao,Nintendo,Nintendo Switch
Case Compatível Nintendo Switch Lite Bolsa Estojo - Modelo 006,R$,39.99,no Pix ,ou 199.00 em 4x de 49.75 sem juros,-,Nao,Sim,Nao,Nintendo,Nintendo Switch
Estojo Case Nintendo Switch Jogo Cabos Acessórios + Pelicula,R$,75.73,no Pix ,ou 369.00 em 8x de 46.13 sem juros,-,Nao,Nao,Nao,Nintendo,Nintendo Switch
Par Controles Joycon sem fio Nintendo Switch Joy-Con (L)/(R) neon red e neon blue Nacional,R$,494.1,no Pix ,ou 348.75 em 7x de 49.82 sem juros,-,Nao,Nao,Sim,Nintendo,Nintendo Switch
Porta Jogos Nintendo Switch - Question Block - Super Mario - Laranja,R$,74.9,no Pix ,ou 370.80 em 6x de 61.80 sem juros,-,Nao,Nao,Nao,Nintendo,Nintendo Switch
Bolsa Capa Case Transporte Luxo Proteção Rosa Compativel com Nintendo Switch ou Nintendo Switch Oled,R$,199.0,no Pix ,ou 317.99 em 7x de 45.43 sem juros,-,Sim,Nao,Nao,Nintendo,Nintendo Switch
Bolsa Transporte + Capa Tpu + Pelicula de Vidro + Grips Compativel com Nintendo Switch Lite,R$,369.0,no Pix ,ou 263.89 em 5x de 52.78 sem juros,-,Nao,Sim,Nao,Nintendo,Nintendo Switch
Case Compatível Nintendo Switch Lite Bolsa Estojo - Modelo 050,R$,39.99,no Pix ,ou 175.00 em 3x de 58.33 sem juros,-,Nao,Sim,Nao,Nintendo,Nintendo Switch
Grips Thumb Nintendo Switch Joy Con Skull &amp Co Fps Gamer BR,R$,78.12,no Pix ,ou 149.00 em 3x de 49.67 sem juros,-,Nao,Nao,Nao,Nintendo,Nintendo Switch
Película de Vidro Protetora para Novo Nintendo Switch Oled,R$,33.16,no Pix ,ou 299.00 em 6x de 49.83 sem juros,-,Sim,Nao,Nao,Nintendo,Nintendo Switch
Kit Para Nintendo Switch Ring Fit - Alça de Perna Mochila Alça Para Ring Fit Cinza,R$,73.16,no Pix ,ou 129.00 em 2x de 64.50 sem juros,-,Nao,Nao,Nao,Nintendo,Nintendo Switch
Jogo Mario Strikers Battle League Nintendo Switch Mídia Física,R$,348.75,no Pix ,ou 290.80 em 2x de 145.40 sem juros,-,Nao,Nao,Nao,Nintendo,Nintendo Switch
Mario Golf: Super Rush - Switch,R$,333.72,no Pix ,ou 133.00 em 2x de 66.50 sem juros,-,Nao,Nao,Nao,Nintendo,Nintendo Switch
Suporte de Parede Docking Stand Compatível com Nintendo Switch - ARTBOX3D,R$,20.13,no Pix ,ou 289.90 em 6x de 48.32 sem juros,-,Nao,Nao,Nao,Nintendo,Nintendo Switch
Case Compatível Nintendo Switch Bolsa Estojo - Zelda Link's Awakening,R$,39.99,no Pix ,ou 149.00 em 3x de 49.67 sem juros,-,Nao,Nao,Nao,Nintendo,Nintendo Switch
Carregador Dock compacto Nintendo Switch 2 em 1 slim BR,R$,317.99,no Pix ,ou 321.80 em 6x de 53.63 sem juros,-,Nao,Nao,Nao,Nintendo,Nintendo Switch
Estojo Case Nintendo Switch Oled Cabe Jogos Cabos Acessórios Preta,R$,57.49,no Pix ,ou 1411.75 em 10x de 141.18 sem juros,-,Sim,Nao,Nao,Nintendo,Nintendo Switch
Cabo Flex Flat Sr + Sl + Chave Y - X Compativel com Joy Con Nintendo Switch,R$,99.0,no Pix ,ou 177.80 em 3x de 59.27 sem juros,-,Nao,Nao,Nao,Nintendo,Nintendo Switch
Base Ipega Multifuncional Para Nintendo Switch Carregador Suporte Cooler 2 USB,R$,237.5,no Pix ,ou 116.49 em 2x de 58.25 sem juros,-,Nao,Nao,Nao,Nintendo,Nintendo Switch
Case Bag Estojo Compatível Nintendo Switch + Película Vidro Oled,R$,168.0,no Pix ,ou 235.80 em 5x de 47.16 sem juros,-,Sim,Nao,Nao,Nintendo,Nintendo Switch
Capa Case Proteção Acrilico Premium Joycon Grip Compativel com Nintendo Switch Padrao,R$,149.0,no Pix ,ou 376.80 em 6x de 62.80 sem juros,-,Nao,Nao,Nao,Nintendo,Nintendo Switch
Bolsa Case Capa Proteção Joycon Grip Compativel com Nintendo Switch ou Nintendo Switch Oled,R$,299.0,no Pix ,ou 391.80 em 6x de 65.30 sem juros,-,Sim,Nao,Nao,Nintendo,Nintendo Switch
Case Compatível Nintendo Switch Bolsa Estojo - Luigi's Mansion 3,R$,39.99,no Pix ,ou 179.00 em 3x de 59.67 sem juros,-,Nao,Nao,Nao,Nintendo,Nintendo Switch
Bolsa Case Compatível Com Nintendo Switch Jogos Cabos Proteção Viagem,R$,123.84,no Pix ,ou 459.90 em 10x de 45.99 sem juros,-,Nao,Nao,Nao,Nintendo,Nintendo Switch
Capa Case e Skin Adesivo Compatível Nintendo Switch Pro Controle - Zelda Tears of the Kingdom Edition,R$,54.99,no Pix ,ou 314.99 em 2x de 157.50 sem juros,-,Nao,Nao,Nao,Nintendo,Nintendo Switch
Adesivo Compatível Nintendo Switch Oled Skin - Modelo 060,R$,49.99,no Pix ,ou 179.00 em 3x de 59.67 sem juros,-,Sim,Nao,Nao,Nintendo,Nintendo Switch
Capa Acrílica Cristal Pokemon Nintendo Switch Lite Película,R$,50.39,no Pix ,ou 149.00 em 3x de 49.67 sem juros,-,Nao,Sim,Nao,Nintendo,Nintendo Switch
Hades - Switch,R$,261.72,no Pix ,ou 267.80 em 5x de 53.56 sem juros,-,Nao,Nao,Nao,Nintendo,Nintendo Switch
Case Capa Estojo + Película Vidro + 4 Grip Compatível com Nintendo Switch,R$,127.68,no Pix ,ou 386.80 em 6x de 64.47 sem juros,-,Nao,Nao,Nao,Nintendo,Nintendo Switch
Grip Thumb Kontrol Freek para Controle Nintendo Switch Pro,R$,74.19,no Pix ,ou 299.90 em 6x de 49.98 sem juros,-,Nao,Nao,Nao,Nintendo,Nintendo Switch
